oai:ecommons.cornell.edu:1813/17471,A biography of and interview with Robert E. Lynk,"Robert E. Lynk was born into a farming family in Schoharie County. Anticipating a life in agriculture, he received his B.S. from Cornell University in 1954. After his marriage to an alumna of Cornell and a 16-month tour of duty in Korea, Bob joined the veterinary Class of 1961, the first cohort of students to matriculate in the new veterinary complex at the eastern end of the Cornell campus. Following graduation, he joined the general practice of Dr. Thomas Vaughn, first in Clarksville, and later in Delmar, New York. Dr. Lynk remained in this practice throughout his professional career, retiring in 1997 to an active life of painting, bowling, and Church activities. Throughout his career, Dr. Lynk has held several offices within the veterinary society at both regional and state levels. He and his wife, Nancy, are quintessential Cornell supporters, active in alumni and other events.","Person interviewed: Robert E. Lynk.  Interviewer: Smith, Donald F.  Interview date: September 10, 2010.  Interview location: Crystal Lake, near Rensselaerville, New York. Date biography was written:  September 2010.",,Interview
oai:ecommons.cornell.edu:1813/17796,"A biography of and interview with Delano L. Proctor, Jr.","Delano L. Proctor, Jr. grew up in Lexington, Kentucky, the son of an equine practitioner. He was assigned to the Veterinary Corps following his graduation from Cornell in 1942. He fulfilled over three years of service in India, preparing mules and horses for the rugged China-Burma-India campaign. Following his discharge in 1946 at the rank of captain, he returned to his father’s veterinary practice where he had a distinguished career as equine veterinarian, board-certified surgeon, and advocate for the profession. He was devoted to the development of the profession at many levels, including serving as A.V.M.A. president in 1985-86. Dr. Proctor had a great admiration for his alma mater, Cornell University, and also had a special affinity for the history of veterinary medicine. He died at age 91 in 2009.","Person interviewed: Delano L. Proctor, Jr.  Interviewer: Smith, Donald F.  Interview date: December 18, 2007.  Interview location: Lexington, Kentucky.  Date biography was written:  October 2010.",,Interview
oai:ecommons.cornell.edu:1813/22013,A biography of and interview with Tevis M. Goldhaft,"Tevis M. Goldhaft (1914-2009) was the son of Arthur Goldhaft VMD ’10, a general practitioner in Vineland, New Jersey. In 1931, Tevis followed his sister, Helen, to Cornell because the University of Pennyslvania did not accept women veterinary students at that time. Following his graduation in 1935, Tevis returned to his father’s practice and then began a 35-year career in the poultry industry that led to the development of one of the largest and most expansive poultry diagnostic and vaccine companies in the country. Vineland Laboratories constructed plants in Mexico, Israel, England and the Virgin Islands, and supervised operations in some South American vaccine plants. Dr. Goldhaft led an active life in his retirement in Haverford, Pennsylvania.","Person interviewed: Tevis M. Goldhaft. Interviewer: Smith, Donald F.  Interview date: September 26, 2007. Interview location: Haverford, PA.
Date biography was written:  March 15, 2009.",,Interview
oai:ecommons.cornell.edu:1813/22955,A biography of and interview with Mitchell E. Kornet,"Raised in a small garden apartment in Queens, N.Y., Mitchell Kornet developed his interest in animals and veterinary medicine at the John Bowne High School in nearby Flushing. While an undergraduate student in Cornell’s College of Agriculture and Life Sciences, he gained valuable experience in the veterinary college’s large animal hospital under the mentorship of surgeon, Dr. Lawrence Kramer. In 1975, he was admitted to the DVM program in the College of Veterinary Medicine. After graduating in 1979, he worked at the Mid Island Animal Hospital and became sole owner in 1983 at age 28. In the aftermath of 9/11/2001, Dr. Kornet was responsible for organizing teams of veterinarians and veterinary technicians treating the search and rescue dogs at ground zero. He has remained very active in Cornell programs and has served as the president of the Agriculture and Life Sciences Alumni Association. He also regularly mentors pre-veterinary students. He and his wife, Renee, have two children, Allison and Robin, both of whom are Cornell graduates.","Person interviewed: Mitchell E. Kornet.  Interviewer: Michelle Pesce ’12, Cornell University.  Interview date: February 17, 2011.  Interview location: E-mail Correspondence.  Date biography was written:  June 2011.",,Interview
oai:ecommons.cornell.edu:1813/28286,A Conversation with Royse P. Murphy,"Abstract: Royse Peak Murphy, native of Norton, Kansas and survivor of the Dust Bowl experience, the Great Depression, then World War II, joined the Cornell Faculty in 1946. His main focus has been plant breeding, releasing many new crop varieties and supervising graduate studies for 21 Ph.D. students and 12 Master of Science students. His international work was extensive. He is an exemplary member of the Cornell University Faculty and served Cornell as a Department Head, Dean of the University Faculty (1964-67) and as a faculty member serving on the Board of Trustees. As has been characteristic of Murph since his ‘retirement’ 32 years ago and despite his recent physical adversities, he has maintained a vigorous devotion to and love for plant breeding – as witnessed by his participation in this video. Interviewed by plant breeder colleague, Donald R. Viands, he discusses his recollections of the plant breeding department at Cornell, supplementing his book on that subject, Evolution of Plant Breeding at Cornell University (http://dspace.library.cornell.edu/handle/1813/23087). Running time: 41 minutes. A biographical sketch by Lee B. Kass, that was presented at the celebration of his 90th birthday, is also included.",QuickTime videos of the interview use H.264 compression. One set is for Apple TV and the other is formatted for the iPhone (and QuickTime Player).,,Interview
oai:ecommons.cornell.edu:1813/28564,"A biography of and interview with Charles W. Raker, VMD","Charles W. Raker was one of the leading equine surgeons of the second half of the 20th century. Raised in Daylesford, Pennsylvania, he received his VMD from the University of Pennsylvania (UP) in 1942.  After several years in general practice, he joined the faculty of the UP as a surgeon involved with all large animal species. As one of the founding faculty of New Bolton Center, he gradually developed a strong clientele for cases involving general and orthopedic surgery of horses. Starting in the 1970s, he began to concentrate on upper respiratory surgery and became a preeminent leader in that field. Raker helped establish the American College of Veterinary Surgeons in the 1960s and later became president of that organization. He was an outstanding teacher and mentor of both veterinary students and surgical residents, and was one of the first to train women large animal surgeons.","Person interviewed: Charles W. Raker.  Interviewer: Khatibzadeh, Sarah M.  Interview date: May 25, 2011.  Interview location: Honey Brook, Pennsylvania.  Date biography was written:  January 2012.",,Interview
oai:ecommons.cornell.edu:1813/28642,A biography of and interview with Jack O. Walther,"Dr. Jack Walther grew up in Nevada and received his veterinary degree from the University of California, Davis in 1963. His equine practice in Reno NV, was punctuated by two years of service in the Army Veterinary Corps during the Vietnam war. He later established three small animal hospitals, also in the Reno area. Active in veterinary associations at both the state and national levels, Dr. Walther ultimately served as the 140th president of the American Veterinary Medical Association (AVMA) in 2003-04. His agenda as president included expanding the public relations programs of the AVMA, and facilitating the formation of a privately-managed testing service for veterinary graduates of foreign and non-accredited colleges. Dr. Walther has served as president of the Western Veterinary Conference and will be recognized in 2013 when the conference program will be named in his honor. In his community activities, Dr. Walther was responsible for transforming the Reno Rodeo, for which he was given the designation, Man of the Decade. He promoted expansion of the Washoe County Airport Authority, assuring improved passenger and commercial air service in the Reno/Sparks area. He was also chair of the board of the National Championship Air Races, for which he was named Man of the Year in 2001. Dr. Walther has three children.","Person interviewed: Jack O. Walther.  Interviewer: Smith, Donald F.  Interview date: February 16, 2010.  Interview location: Las Vegas, NV.  Date biography was written:  December 2011.",,Interview
oai:ecommons.cornell.edu:1813/28694,"A biography of and interview with George E. Ross, Jr.","Growing up in Kansas, George E. Ross, Jr. watched as the veterinarians cared for his horse and realized he aspired to be a surgeon. He was the first member of his family to graduate from college and received his DVM from Kansas State University College of Veterinary Medicine. After graduating in 1960, Dr. Ross completed an internship in small animal medicine and surgery at the New York State Veterinary College (now Cornell University College of Veterinary Medicine) and then joined the faculty at Cornell, teaching small surgery for ten years. He was a member of the first class of board certified surgeons accepted by examination in 1968. Dr. Ross left Cornell in 1972 to establish the Colonial Veterinary Hospital in Ithaca, NY, which he later passed to his son Thomas, who also became a veterinary surgeon. With the continued consulting and support of Dr. Ross, Colonial Veterinary Hospital has evolved into one of the largest and most comprehensive specialty practices in the Finger Lakes area. George and his wife, Kay, have three children (Thomas, Donald, and Amy), and currently live in Ithaca, NY.","Person interviewed: George E. Ross, Jr.  Interviewer: Massaro, Andrew J.  Interview date: February 9, 2012.  Interview location: Ithaca, NY.
Date biography was written:  March, 2012.",,Interview
oai:ecommons.cornell.edu:1813/29007,A biography of and interview about Henry E. Grossman,"Henry E. Grossman received his DVM from Cornell University in 1938 and spent his entire professional career (1938-1998) in small animal practice in Brooklyn, New York. He was one of 17 Jewish students who matriculated in 1931 but took a leave of absence during his sophomore year and returned as a married student two years later. His wife, Florence, worked in downtown Ithaca. Establishing a companion animal practice in the waning years of the Great Depression was challenging, but the Grossman practice prevailed and Henry became a leading advocate of small animal medicine. His practice was accredited by the American Animal Hospital Association. He was active in organized veterinary medicine and served as president of both the Veterinary Medical Association of New York City and the New York State Veterinary Medical Society. Florence also held leadership positions for the Auxiliary to the State Society. Dr. Grossman retired from practice for health reasons in 1998 and died in 2000.  Mrs. Grossman died in January 2010.","Person interviewed: Mrs. Florence Grossman, wife of Henry E. Grossman.  Interviewer: Smith, Donald F. Interview date: November 6, 2007.  Interview location: New York, NY.  Date biography was written: May 2012.",,Interview
oai:ecommons.cornell.edu:1813/29544,A biography of and interview with Edward Hagyard Fallon,"When Edward Hagyard Fallon received his DVM in 1956, he joined the practice in Lexington, KY, now known as Hagyard Equine Medical Institute. He is the fourth in a line of family veterinarians that dates to 1876 when a Scottish-educated veterinarian named Edward Thomas Hagyard was called to Kentucky to consult on a valuable Shorthorn bull. An equine practice (institute) of world renown grew from that original encounter.  Hagyard’s three sons were all graduates of the Ontario Veterinary College and worked either in the Lexington practice or in Nashville, Tennessee. Third-generation Charles Edward Hagyard (O.V.C. 1924) joined the practice following his graduation from the O.V.C. in 1924, and about 15 years later, Arthur Davidson (Iowa State University 1936) and William McGee (Washington State University 1940) completed the troika of partners for what for decades became known simply as Hagyard-Davidson-McGee. The son of Charlie Hagyard’s sister was Edward Fallon who studied at Cornell, as did Edward’s son, Luke Hagyard Fallon, the fifth generation equine veterinarian who received his DVM in 1996. The present interview includes not only Drs. Edward and Luke Fallon, but also Edward’s wife, Priscilla, William McGee and his granddaughter, Ali McGee Kelly, and Dr. Walter W. Zent ’63.","Person interviewed: Edward Hagyard Fallon.  Other participants: William R. McGee, DVM (WSU 1940), Walter W. Zent, DVM (Cornell 1963), 	Luke Hagyard Fallon, DVM (Cornell 1996), Mrs. Priscilla Fallon, Ms. Ali McGee.  Interviewer: Smith, Donald F.  Interview date: June 25, 2010. Interview location: Lexington, Kentucky.  Date biography was written:  June 2012.",,Interview
oai:ecommons.cornell.edu:1813/33696,"Interview with Gracian Chimwaza, Director of Information Training and Outreach Centre for Africa (ITOCA)","TEEAL is a digital library (www.TEEAL.org) that has revolutionized agricultural research in the developing world ranging from Asia and Africa to Latin America. The Albert R. Mann Library at Cornell developed the library in 1999, working with important publishers and with funding from such organizations as USAID, the World Bank, UNESCO, and the Rockefeller Foundation. TEEAL provides digital access to more than 200 peer-reviewed international journals from some 60 major publishers. TEEAL has spread throughout Africa largely through the efforts of the Information Training and Outreach Centre for Africa (ITOCA) which has served as a marketing and support agency for Mann in Africa. Emeritus Professor Royal Colle interviewed Gracian Chimwaza, ITOCA's executive director, during the 2013 World Congress of the International Association of Agricultural Information Specialists, which was hosted by Mann Library. In this interview Chimwaza discusses the positive impact of TEEAL on researchers, faculty and students, the significance of new information technology in fostering the adoption of TEEAL in African countries, and the on-going relationship of Mann with ITOCA and the African community of  agricultural scholars.  Throughout the interview, the library is referred to as ""TEEAL"" which is the acronym for The Essential Electronic Agricultural Library.",,,Interview
oai:ecommons.cornell.edu:1813/33697,An Interview with Dr. Gelia Castillo,"Many persons have been instrumental in building strong professional relations between Cornell University and the University of Philippines College of  Agriculture at Los Baňos. Many came from the Philippines during the 1950s and 1960s to study agriculture and rural development as UPLB began its climb after the Second World War to become a major Asian university. Dr. Gelia T. Castillo was one of those who earned a PhD at Cornell in the 1960s and returned to The Philippines where she gained recognition as an international authority in agriculture and rural development. She earned her doctorate at Cornell  in Rural Sociology which provided a foundation for her study of Filipino farmers.  Her book All in a Grain of Rice is the first book written by a Filipino about the Filipino farmers' response to new agricultural technology. She is a consultant for the International Rice Research Institute and has held more than a dozen important science and technology administrative positions during her productive career. In July 2013, Royal Colle met Dr. Castillo in her home at Los Banos to interview her about her experiences at Cornell and her work with agricultural development in The Philippines.",,,Interview
oai:ecommons.cornell.edu:1813/33715,Interview with William (Ronnie) Coffman about the International Programs in the College of Agriculture and Life Sciences,"In this interview, Professor Ronnie Coffman, Director of International Programs in Cornell’s College of Agriculture and Life Sciences, reviews the activities scheduled in celebrating the 50th Anniversary of the International Program, as well as a number of the on-campus activities that have been sustained during the life of the Program.
Overseas activities that formed the basis of experience for Cornell are reviewed including the crop improvement and farm survey programs in China in the 1920s and the collaboration with the College of Agriculture of the University of The Philippines in the 1950s. The environment that fostered the establishment of the Program in 1963 as well as the numerous on-campus and overseas activities in subsequent years are explained in detail.
Professor Emeritus Edwin Oyer, a former Director of the Program, interviewed Professor Coffman.",,,Interview
oai:ecommons.cornell.edu:1813/33716,A Conversation with John Lumley,Professor Emeritus Sidney Leibovich of the School of Mechanical And Aerospace Engineering talks to Professor John Lumley about his career in the School of Mechanical and Aerospace Engineering.,,,Interview
oai:ecommons.cornell.edu:1813/33717,A Conversation with Riccardo Giovanelli,"Prof. Donald Campbell of Astronomy at Cornell University interviews Professor of Astronomy, Riccardo Giovanell, about his work at the Arecibo Observatory.",,,Interview
oai:ecommons.cornell.edu:1813/39911,"Shiffrin, Steve H.","From the video archives of the Cornell Law School Heritage Project. The interviewer is Peter W. Martin; the videographer, Helen Oland. This video covers Steve Shiffrin’s reflections on his career as a law professor. Shiffrin is the Charles Frank Reavis Sr., Professor of Law (Emeritus) at Cornell Law School. He began his law school teaching career at UCLA in 1977, receiving tenure in 1981. He has been a visiting professor of law at Boston University, Harvard University, Seattle University, and the University of Michigan. He joined the Cornell faculty in 1987. (Duration 59:28)",,,Interview
oai:ecommons.cornell.edu:1813/40246,"Clermont, Kevin M.","From the video archives of the Cornell Law School Heritage Project. The interviewer is Peter W. Martin; the videographer, Michael d’Estries. This video covers Professor Kevin Clermont’s reflections on his career as a law professor at Cornell Law School. Clermont is a specialist in the procedural aspects of litigation. After his graduation from Harvard Law School in 1971, Prof. Clermont clerked for the late Hon. Murray Gurfein of the Southern District of New York, and then spent two years in private practice as an associate at Cleary, Gottlieb, Steen & Hamilton. Since joining the Cornell Law School Faculty in 1974, Prof. Clermont has authored a good number of books on civil procedure. His coauthored casebook, Materials for a Basic Course in Civil Procedure, is regarded as a model of careful legal craftsmanship and also a thoughtful introduction for students.",,,Interview
oai:ecommons.cornell.edu:1813/40307,"Roberts, Ernest F.","From the video archives of the Cornell Law School Heritage Project. The interviewer is Peter W. Martin; the videographer, Michael d’Estries. This video covers Professor E.F. Roberts’ reflections on his career as a law professor. Roberts is the Edwin H. Woodruff Professor of Law, Emeritus, at Cornell Law School. A longtime specialist in land-use policy, Prof. Roberts has had a distinguished career as an academic and consultant on environmental issues. He served in private practice in Northampton before turning to teaching law at Villanova from 1957 to 1964, when he came to serve on the Cornell Law School faculty. He has also served on the Hudson River Basin Study Group, and was Chairman of the Ithaca Landmarks Preservation Commission, and is author of landmark studies on acquisition of public lands and structures for water resources management.",Duration 46:33,,Interview
oai:ecommons.cornell.edu:1813/40332,"Geiger, Richard D.","From the video archives of the Cornell Law School Heritage Project. The interviewer is Peter W. Martin; the videographer, Michael d’Estries. This video covers Richard Geiger’s reflections on his career as Associate Dean of Communications and Enrollment at Cornell Law School from 1987-2015.",Duration: 1:05:30,,Interview
oai:ecommons.cornell.edu:1813/40530,Robert A. Hillman,"From the video archives of the Cornell Law School Heritage Project. The interviewer is Peter W. Martin; the videographer, Michael d’Estries. This video covers Professor Robert A. Hillman’s reflections on his career as a law professor. A 1972 graduate of Cornell Law School, Professor Hillman began his teaching career at the University of Iowa College of Law. He joined the Cornell Law School Faculty in 1982, and in addition to teaching and authoring or co-authoring several major contracts and commercial law works, he served as Associate Dean from 1990-1997. Hillman is the Edwin H. Woodruff Professor of Law.",Duration: 59:26,,Interview
oai:ecommons.cornell.edu:1813/40752,"Interview with Jon Baskin--May 15, 2015","Jon Baskin is co-founder and editor of The Point magazine in Chicago. He is also a graduate student at the University of Chicago's Committee on Social Thought and the author of many essays and works of criticism for venues such as The Los Angeles Review of Books, The Nation, n+1, The New York Observer, BookForum, Salon, and The Point. Earlier in his career he was a fact checker for various magazines, including Popular Science, Inc Magazine, The Atlantic Monthly, and n+1. The interview was conducted at the office of The Point in Chicago on May 15, 2015.",,,Interview
oai:ecommons.cornell.edu:1813/41473,"An Interview of Lee Webb, 2005","Lee Webb was a former student activist in the 1960s, then teaching in Vermont when he founded the Conference on Alternative State and Local Policies in 1975. Here he describes his own background, his contacts and collaborators founding the Conference, its fortunes through the 1970s. This interview, by Pierre Clavel, was conducted in 2005, when Webb was retired and pursuing a PhD in Maine.","Typescript, 9 pp.",,Interview
