oai:ecommons.cornell.edu:1813/11027,The Text and the Object,,"A winner of the James F. Slevin Assignment Sequence Prize, this sequence originates from Near Eastern Studies 176, Two Authors, Three Faiths: Don Quixote as the History of Medieval Iberia.  Part of a content unit on Islamic science in al-Andalus, students are asked in this sequence of essays to think about the material record as another point of entry for answering historical questions that arise while reading Don Quixote. The sequence describes the steps of a final research and writing project in which students create their own museum exhibition and catalogue. Students engage in in-class and preparatory work such as oral presentations. 12 page pdf",,Learning Object
oai:ecommons.cornell.edu:1813/11024,Voice and Register in Gloria Anzaldua's Borderland/La frontera,,"A winner of the Knight Award for Writing Exercises and Handouts, this work originates from Spanish Literature 113, Globalization and Literature. The goal of this three-part exercise from the eighth week of the seminar is to familiarize students with the concepts of authorial voice, register, and tone. Although the exercise focuses on a work of literature, Gloria Anzaldua's Borderland/La frontera, and culminates with student-produced creative writing, it allows students to develop an awareness of these features that they can transfer to other writing. 4 page pdf",,Learning Object
oai:ecommons.cornell.edu:1813/11023,Revisioning the Sentimental in Flaubert,,"A winner of the James F. Slevin Assignment Sequence Prize, this sequence originates from English 111, Life, Death, and Desire in Nineteenth-Century Literature. The sequence, a concluding project for the semester, offers four stages, with preparatory writing, that move students toward a final essay on Flaubert's Sentimental Education. The sequence, which  builds on previous conversation about sentiment, feeling, and style, focuses on paragraph transitions, meta-commentary, and conclusions.  10 page pdf",,Learning Object
oai:ecommons.cornell.edu:1813/11022,Styles of Writing and the Afghanistan Model,,"A winner of the Knight Award for Writing Exercises and Handouts, this work originates from Government 100, Power and Politics: Power, Tragedy, and Honor-Three Faces of War. ""Styles of Writing and the Afghanistan Model"" is an in-class writing exercise designed with four goals in mind. Students should learn how to 1) distinguish between different sources in political science: academic journals, policy journals, newspapers, and news magazines; 2) identify the type of content each source tends to provide; 3) recognize the style of writing in each source and its intended audience; and 4) adopt an appropriate style of writing for their own work. Essay assignments throughout the semester require students to write in different styles for different purposes and audiences. 5 page pdf",,Learning Object
oai:ecommons.cornell.edu:1813/11016,"Clarity, Concision, and Introductory Paragraphs",,"A winner of the Knight Award for Writing Exercises and Handouts, this work originates from Medieval Studies 101.03, Aspects of Medieval Culture: Barbarian Kings and Kingdoms-The Franks in the Early Middle Ages. With three in-class activities, students examine the sources of clarity and concision. In the first exercise students analyze short excerpts by respected scholars; in the second they examine introductory paragraphs by scholars; in the third they examine their own introductory paragraphs.  7 page pdf",,Learning Object
oai:ecommons.cornell.edu:1813/10939,That's Not Cricket,,"A winner of the John S. Knight Assignment Sequence Prize, this sequence originates from Anthropology 152, Sports and Culture.  Students write a sequence of three essays drawing on the same data to use in writing for three widely disparate audiences. The ""data"" is drawn from the game of cricket, as played not only in Great Britain but in the Trobriand Islands. Preparatory experiential learning for students includes playing a trial game of cricket, with attendant ceremonies. 6 page pdf",,Learning Object
oai:ecommons.cornell.edu:1813/11015,Specificity of Language; Writing an Abstract; Thesis Proposal and Group Review,,"A winner of the Knight Award for Writing Exercises and Handouts, this work originates from English 158, American Literature and Culture: Capes and Capers-The Anti-Hero in American Literature and Film.  In three separate in-class activities, students collaboratively work on specificity of language, on writing an abstract, and on developing a thesis proposal with peer review. Handouts for the activities are included. 8 page pdf",,Learning Object
oai:ecommons.cornell.edu:1813/11008,Evidence and Argument,,"A winner of the Knight Award for Writing Exercises and Handouts, this work originates from Government 100, Power and Politics: Globalization in the Twenty-First Century-Progress, Promise, and Problems. The in-class activity is designed to encourage students to find and use evidence to support their claims, as a jumping-off point for discussion of what constitutes evidence and how we judge different types of evidence. The exercise is also designed to encourage students to revise their arguments and theses in light of conflicting evidence. 3 page pdf",,Learning Object
oai:ecommons.cornell.edu:1813/11007,Preparing to Write a Research Paper,,"A winner of the Knight Award for Writing Exercises and Handouts, this work originates from Medieval Studies 101, Aspects of Medieval Culture: The Anglo-Saxons-Saints, Scholars, and Heroes.  Handouts and exercises over the course of a semester are designed to help students develop the skills they need to write a successful research paper. Three categories of skills are addressed: integrating quotations; critiquing secondary scholarship; and finding relevant secondary sources. 9 page pdf",,Learning Object
oai:ecommons.cornell.edu:1813/11011,Literary Detection,,"A winner of the James F. Slevin Assignment Sequence Prize, this sequence originates from English 147, The Mystery in the Story.  The sequence presents the semester's six assignments, with preparatory writing and activities such as study questions and peer review. The essays build from two essays that are not full literary analyses; to two literary analyses with directive prompts; to a revision and expansion; to several brief response papers; and finally to a seven-page literary analysis for which students develop their own arguments, possibly from one of the response papers. Materials include handouts on topics such as ""What an 'A' Essay Does,"" ""Close Reading,"" and ""Developing a Thesis Statement.""   The sequence aims at four goals: (1) students become proficient readers; (2) they can construct clear paragraphs; (3) they can process secondary sources; and (4) they can integrate these three skills to write essays with complex claims and argumentative tension. 28 page pdf",,Learning Object
oai:ecommons.cornell.edu:1813/11012,Writing for the Real World: Composing a Letter to the Editor,,"A winner of the James F. Slevin Assignment Sequence Prize, this sequence originates from Development Sociology 111, Corporate Controversies: Exploring Big Scandal in Big Business. Students choose an article or editorial from a major local, national, or international newspaper or magazine to serve as the basis for writing a letter to the editor. They then complete a series of assignments and revisions that culminates in a 200-400 word letter to the editor of that periodical. The sequence includes three main writing assignments as well as in-class exercises on topics such as sentences and peer review. 9 page pdf",,Learning Object
oai:ecommons.cornell.edu:1813/11013,Three Types of Scientific Writing,,"A winner of the James F. Slevin Assignment Sequence Prize, this sequence originates from Theoretical and Applied Mechanics 175, Writing About Engineering Problems. The sequence of three assignments introduces students to scientific writing in several genre. For the first essay, ""How Things Work,"" students select an everyday object and describe how it works in the form of a popular science article. For the second essay, ''Climate Change,'' students develop the skill of data analysis in order to build an argument. For the third essay, ''Engineering in Sports,'' students write a patent-like description of a technology designed to improve athletic performance. Preparatory writing and in-class activities include small group peer review, oral presentations, and study of style and language. 10 page pdf",,Learning Object
oai:ecommons.cornell.edu:1813/10929,Containment and Hegemony,,"A winner of the John S. Knight Assignment Sequence Prize, this sequence originates from Government 100, Power and Politics: Theories of Hegemony. The sequence presents the semester's nine essay assignments, which focus on persuasive argumentation. Early writings emphasize the description and analysis of international relations and foreign policy theories; students then practice applying theories to particular documents and historical periods. Assignments go on to involve taking policy positions and integrating those positions with theoretically informed long-range strategies. Progressively more sophisticated techniques for recognizing and constructing effective arguments are introduced. 12 page pdf",,Learning Object
oai:ecommons.cornell.edu:1813/10995,"Assignments for Theater 163, ""Survey of One-Act Plays""",,"A winner of the John S. Knight Assignment prize, this sequence originates from Theater, Film and Dance 163, American Drama in Sixty Minutes or Less: A Survey of One-Act Plays. Students practice different kinds of writing while approaching one-act plays through a range of considerations. Short assignments ask students to write from the perspective of theatre professionals, using appropriate genre. Longer essays, all with preparatory writing, include an essay on a ten-minute play, which students working in pairs present in class; a comparison and contrast essay; and the creation of a hypothetical anthology of one-act plays for which students write the introduction. Materials include study questions for the plays and a handout on dramatic terms. 27 page pdf",,Learning Object
oai:ecommons.cornell.edu:1813/10999,Three Introductions,,"A winner of the Knight Award for Writing Exercises, this work originates from Anthropology 148, Common Places: Cultural Sites of Memory and Meaning. As an in-class activity followed by discussion, students write three hypothetical introductions, for each one using the same set of facts, drawn from the seminar's topic. A handout provides instructions  in regard to the distinct style of each introduction. 5 page pdf",,Learning Object
oai:ecommons.cornell.edu:1813/11003,Thinking and Writing about Globalization,,"A winner of the John S. Knight Assignment Sequence Prize, this sequence originates from Government 100, Globalization in the Twenty-First Century: Progress, Promise, and Problems.  The sequence consists of five formal essays that move from assignments that emphasize basic definitions/concepts; to assignments that focus on defending claims with evidence (and incorporating counter-argument); to assignments that stress critical evaluations of arguments and evidence; to the final assignment, which asks students to bring together all of these elements in a short research paper. Assignments encompass a variety of topics and styles. Preparatory activities include in-class writing exercises, guided reading exercises, discussion, peer review, and other preparatory writing. The assignments aim  (1) to help students understand and practice good argumentative writing in the social sciences; (2) to facilitate students' coming to understand that writing is an essential part of the process of creating knowledge.  44 page pdf",,Learning Object
oai:ecommons.cornell.edu:1813/11005,Is There Any Hope for Pacifism?,,"A winner of the John S. Knight Assignment Sequence Prize, this sequence originates from Medieval Studies 101, Aspects of Medieval Culture:  Turning the Other Cheek�Pacifism in Medieval Europe.  The series of three essays (the fourth, fifth, and sixth in the semester) springs from the question on which students have written since the beginning of the course: ""What comes to mind when you hear the word 'pacifism'?"" The three assignments are designed to help students analyze and critique their understanding of pacifism.  Preparatory writing includes frequent Blackboard postings on the readings, small at-home reading and writing exercises, and the in-class study and writing of a medieval genre, the summa, in the form of a modern mini- summa.  16 page pdf",,Learning Object
oai:ecommons.cornell.edu:1813/10987,Passing Out to the Sound of the Passive Voice,,"A winner of the Knight Award for Writing Exercises, this work originates from Anthropology 183, Freedom and Control. Use of a handout, in-class activities, and out of class observations lead students to discover why they should resist passive constructions in their writing and increase their understanding of social and cultural control. 5 page pdf",,Learning Object
oai:ecommons.cornell.edu:1813/10986,Transitions Exercise,,"A winner of the Knight Award for Writing Exercises and Handouts, this work originates from the Department of History, Hist 106, African Life Histories. The exercises assist students in the use and study of transitional words and phrases in their own and others' texts.  In-class exercises address transitions between paragraphs and between sentences in a paragraph. 6 page pdf",,Learning Object
oai:ecommons.cornell.edu:1813/10985,Question and Answer,,"A winner of the Knight Award for Writing Exercises, this work originates from English 105, Women and Writing: ""This Strange House"" - Women and the City 1918-1939.  A one-page handout offers guidance to students in ways to read essay assignments carefully and to ask questions about the essay topics before embarking on writing. Students put this process to work in the first critical essay assignment and its preparatory writing. The goal is to disrupt the tendency to develop a thesis prematurely. 6 page pdf",,Learning Object
oai:ecommons.cornell.edu:1813/10984,Constructing a Counter-Argument,,"A winner of the John S. Knight Assignment Sequence Prize, this sequence originates from Anthropology 197, Consuming Culture: The Language of Everyday Objects.  With the goal of helping students learn to incorporate counter-arguments into their thinking and writing, the sequence asks students to focus on one of two ""everyday objects"": high heels and breast implants. Preparatory writing includes in-class writing in which students express their initial opinions; writing from the opposite point of view after drawing on external sources which they have researched; and writing a final essay that incorporates counter-arguments. 7 page pdf",,Learning Object
oai:ecommons.cornell.edu:1813/10994,Civil Wars and Their Transnational Connections,,"A winner of the John S. Knight Assignment Sequence Prize, this sequence originates from Government 100, Power and Politics: Global Chaos or New World Order? The Future of War in a Globalizing World. This sequence on the theme of ""civil war in a transnational context"" comprises the central portion of the writing seminar, including writing assignments two through five. The four assignments (which follow an opening expository writing assignment) are as follows: (1) A ""two sided"" piece of writing on the topic ""markets and civil wars""; (2) a first person ""war crimes testimonial"" based on the study of Rwanda; (3) a write up of a speech on democracy promotion - for or against; and (4) a memo to the Secretary of State about intervention in Sudan.  Materials include assessment/grading grids. 13 page pdf",,Learning Object
oai:ecommons.cornell.edu:1813/10992,Modern Visions of the Medieval and Renaissance World,,"A winner of the John S. Knight Assignment Sequence Prize, this sequence originates from the Department of History, Hist 100, Modern Visions of the Medieval and Renaissance World.  This sequence for the entire course offers an extended series of inter-related assignments, all of which build toward the final essay, an 8-10 page research paper. Students apply the methods they have learned- of both primary source analysis and historiographical analysis- to their own, individual, research projects. Preparatory writing and activities include study questions, learning to use primary and secondary sources, and studying the presentation and interpretation of evidence. Materials include study questions (e. g. on The Da Vinci Code and Daughter of Time), essay assignments, and handouts (e.g. ""Evaluating Primary Sources""). 17 page pdf",,Learning Object
oai:ecommons.cornell.edu:1813/10989,"The Assignment Sequence for Music 111, Sound, Sense, and Ideas: Beethoven and Today's Music",,"A winner of the John S. Knight Assignment Sequence Prize, this sequence originates from Music 111, Sound, Sense, and Ideas: Beethoven and Today's Music.  The sequence includes all the assignments for the course, each of which is accompanied by two short assignments (three paragraphs).  The short assignments fulfill one or more of four principal functions: (1) to address one important issue or skill in writing, (2) to encourage closer and more critical engagement with the reading material, (3) to draw attention to the ways in which the reading material offers models for good writing, and (4) to introduce concepts or approaches relevant to the main essay. Materials include all the short and long assignments and the course calendar for the semester. 38 page pdf",,Learning Object
oai:ecommons.cornell.edu:1813/10990,Writing about Musicals: Sentences and Style,,"A winner of the Knight Award for Writing Exercises, this work originates from Theater, Film and Dance 157, Singing, Dancing, and Hollywood Magic: Writing About Musicals. The in-class activities ask students to compare the style (sentence length, vocabulary, and so on) of a review by Roger Ebert to analyses by academics. 5 page pdf",,Learning Object
oai:ecommons.cornell.edu:1813/10978,"""Making the Stomach Believe"": Cinematic Adaptation",,"A winner of the John S. Knight Assignment Sequence Prize, this sequence originates from English 158, American Literature and Culture: Narratives of the Vietnam War. The sequence encompasses the third major unit of the course, entitled '""Making the Stomach Believe': Cinematic Adaptation,"" which focuses on two central texts: The Short Timers, a novel by Gustav Hasford, and Full Metal Jacket, Stanley Kubrick's 1987 film adaptation of that novel. The overarching objectives are to familiarize students with the process of film adaptation and to facilitate in their writing the drawing of complex connections not only between texts but between different mediums of art. Preparatory writing includes a screenplay assignment, eJournals (see handout), thesis statements, revision, and peer review (see handout). 13 page pdf",,Learning Object
oai:ecommons.cornell.edu:1813/10976,The Language of Shell-Shock: Reading and Writing about World War I Poetry,,"A winner of the John S. Knight Assignment Sequence Prize, this sequence originates from English 185, Writing about Literature: Shell-Shock, Culture-Shock-World War I and English Literature. The five-week sequence of three essays focuses on the ways in which language attempts to communicate experience and on the specifics of poetic language.  Materials for preparatory writing and in-class activities include handouts that focus on comparison and contrast, revision, close reading, and language and style. 21 page pdf",,Learning Object
oai:ecommons.cornell.edu:1813/10980,Fanfares,,"A winner of the Knight Award for Writing Exercises, this work originates from Music 111, Sound, Sense, and Ideas: Beethoven and Today's Music. Designed primarily as in-class work, the four exercises focus on the word (e.g. ""however""), phrase (e.g. ""on the one hand""), or grammatical formulation (e.g. ""given X, therefore Y"") that signals the direction of an argument. Hence, fanfares can include everything from the humble colon to formulations such as ""and this is the very crux of the matter."" 8 page pdf",,Learning Object
oai:ecommons.cornell.edu:1813/10979,Before Creation and After,,"A winner of the John S. Knight Assignment Sequence Prize, this sequence originates from English 141, The Bible and Ancient Authors.  The sequence, ""Before Creation and After,"" a series of assignments for the first three essays of the semester, deals with Gilgamesh and the creation stories. In writing the three essays, students progress from gathering quality evidence to being able to analyze that evidence in the form a thought-provoking thesis and supporting paragraphs. Materials in addition to essay assignments with rationales include handouts (e.g. on drafts, developing a thesis, and peer review), and descriptions of related in-class activities such as debates and role-playing. 25 page pdf",,Learning Object
oai:ecommons.cornell.edu:1813/34506,Beyond Penguins and Polar Bears eZine,"Using NCore OnRamp, a content management and communications system, and Expert Voices, an online magazine for K5 teachers was created that included twenty issues about polar science topics commonly found in the elementary curriculum. Content includes standards-based science and content-rich literacy learning across five departments (In the Field: Scientists at Work, Professional Learning, Science and Literacy, Across the Curriculum, Polar News and Notes and Podcasts).  This record has the BPPB website files attached to it.  There is also a link to the OSU hosted version of the website.",NSDL Project Archive link: http://nsdl.library.cornell.edu/code/#websites OSH hosted site http://beyondpenguins.ehe.osu.edu/,,Learning Object
oai:ecommons.cornell.edu:1813/40768,3-Corner Field Farm (Ecology of food),,Contributing institution: Skidmore College,,Learning Object
oai:ecommons.cornell.edu:1813/40769,Analysis of marketing strategies (Agricultural marketing),,Previously hosted as part of Mann Library's Locale collection.,,Learning Object
oai:ecommons.cornell.edu:1813/40770,Chef's choice field trip: Chez Sophie Bistro (Ecology of food),,Contributing institution: Skidmore College,,Learning Object
oai:ecommons.cornell.edu:1813/40771,Pleasant Valley Farm (Ecology of Food),,Contributing institution: Skidmore College,,Learning Object
oai:ecommons.cornell.edu:1813/40772,Sustainable agriculture curriculum,,Contributing institution: University of Kentucky,,Learning Object
oai:ecommons.cornell.edu:1813/40774,"Sustainable agriculture: an exploration of definitions, university educational programs and the inclusion of farmworker issues, and sustainable agriculture at the University of Minnesota – Twin Cities",,Previously hosted as part of Mann Library's Locale collection.,,Learning Object
oai:ecommons.cornell.edu:1813/40775,Food systems lab manual,,Contributing institution: University of California at Davis,,Learning Object
oai:ecommons.cornell.edu:1813/40776,Behavioral deactivation of plant defenses (Ecology of food),,Contributing institution: Skidmore College,,Learning Object
oai:ecommons.cornell.edu:1813/40777,Soils lab handout (Introduction to sustainable agriculture),,Contributing institution: University of California at Davis,,Learning Object
oai:ecommons.cornell.edu:1813/40778,Sustainability rubric lab handout (Introduction to sustainable agriculture),,Contributing institution: University of California at Davis,,Learning Object
oai:ecommons.cornell.edu:1813/40779,Rotation exercise (Biological pest management),,Previously hosted as part of Mann Library's Locale collection.,,Learning Object
oai:ecommons.cornell.edu:1813/40780,Pest management lab,,Contributing institution: University of California at Davis,,Learning Object
oai:ecommons.cornell.edu:1813/40781,Crops lab materials,,Contributing institution: University of California at Davis,,Learning Object
oai:ecommons.cornell.edu:1813/40782,Lab handout on group work (Introduction to sustainable agriculture),,Contributing institution: University of California at Davis,,Learning Object
oai:ecommons.cornell.edu:1813/40783,Introduction to sustainable agriculture lab schedule,,Contributing institution: University of California at Davis,,Learning Object
oai:ecommons.cornell.edu:1813/40786,Class exercise - what characterizes sustainability? (Introduction to sustainable agriculture),,Contributing institution: University of California at Davis,,Learning Object
oai:ecommons.cornell.edu:1813/40787,Quick class assessment - who are we? (Introduction to sustainable agriculture),,Contributing institution: University of California at Davis,,Learning Object
oai:ecommons.cornell.edu:1813/40788,Agriculture and vedic agriculture quotes,,Previously hosted as part of Mann Library's Locale collection.,,Learning Object
oai:ecommons.cornell.edu:1813/40789,Gardening quotes,,Previously hosted as part of Mann Library's Locale collection.,,Learning Object
oai:ecommons.cornell.edu:1813/40790,Workshops for creative engagement title page,,Contributing institution: Iowa State University,,Learning Object
oai:ecommons.cornell.edu:1813/40791,Beekeeping links from YouTube,,Previously hosted as part of Mann Library's Locale collection.,,Learning Object
oai:ecommons.cornell.edu:1813/40794,"Discussion, preparation, marketing (Ecology of food)",,Contributing institution: Skidmore College,,Learning Object
oai:ecommons.cornell.edu:1813/40795,"Cover crop profiles: Illinois, Indiana, Iowa, Michigan, Ohio",,Previously hosted as part of Mann Library's Locale collection.,,Learning Object
oai:ecommons.cornell.edu:1813/40796,Orchard plan application exercise,,Previously hosted as part of Mann Library's Locale collection.,,Learning Object
