oai:ecommons.cornell.edu:1813/40797,Ecology of food research project,,Contributing institution: Skidmore College,,Learning Object
oai:ecommons.cornell.edu:1813/40798,Practicum in organic farming and gardening,,Contributing institution: Washington State University,,Learning Object
oai:ecommons.cornell.edu:1813/40799,Ecology of food,,Contributing institution: Skidmore College,,Learning Object
oai:ecommons.cornell.edu:1813/40800,"Food, society, and environment",,"Contributing institution: California State University, Fresno",,Learning Object
oai:ecommons.cornell.edu:1813/40801,Soils in the environment,,"Contributing institution: California State University, Fresno",,Learning Object
oai:ecommons.cornell.edu:1813/40802,Organic farming,,"Contributing institution: California State University, Fresno",,Learning Object
oai:ecommons.cornell.edu:1813/40803,SUSAG 162,,Contributing institution: Santa Rosa Junior College,,Learning Object
oai:ecommons.cornell.edu:1813/40804,Introduction to sustainable agriculture,,Previously hosted as part of Mann Library's Locale collection.,,Learning Object
oai:ecommons.cornell.edu:1813/40805,Organic farming principles and practices,,Contributing institution: Michigan State University,,Learning Object
oai:ecommons.cornell.edu:1813/40806,Organic crop production,,Previously hosted as part of Mann Library's Locale collection.,,Learning Object
oai:ecommons.cornell.edu:1813/40807,Introduction to sustainable agriculture,,Contributing institution: University of California at Davis,,Learning Object
oai:ecommons.cornell.edu:1813/40808,Sustainable agriculture schedule,,Contributing institution: University of Missouri,,Learning Object
oai:ecommons.cornell.edu:1813/40809,Cultural perspectives on sustainability,,Contributing institution: University of Kentucky,,Learning Object
oai:ecommons.cornell.edu:1813/40810,Sustainable agriculture,,Contributing institution: University of Missouri,,Learning Object
oai:ecommons.cornell.edu:1813/40811,Introduction to sustainable agriculture,,Previously hosted as part of Mann Library's Locale collection.,,Learning Object
oai:ecommons.cornell.edu:1813/40812,Introduction to the theory and practice of sustainable agriculture,,Syllabus for the University of Missouri's Agriculture 2215 course.,,Learning Object
oai:ecommons.cornell.edu:1813/40813,Karibu Kenya: culture and agriculture in Africa,,Contributing institution: University of Wyoming,,Learning Object
oai:ecommons.cornell.edu:1813/40814,Sustainable agriculture,,Contributing institution: University of Wyoming,,Learning Object
oai:ecommons.cornell.edu:1813/40815,Sustainable livestock management,,Previously hosted as part of Mann Library's Locale collection.,,Learning Object
oai:ecommons.cornell.edu:1813/40816,"Community, food, and agriculture: a survey",,Previously hosted as part of Mann Library's Locale collection.,,Learning Object
oai:ecommons.cornell.edu:1813/40817,Community food and agricultural systems,,Previously hosted as part of Mann Library's Locale collection.,,Learning Object
oai:ecommons.cornell.edu:1813/40818,Ecology of agricultural systems,,Contributing institution: Pennsylvania State University,,Learning Object
oai:ecommons.cornell.edu:1813/40819,Organic food and agriculture,,Previously hosted as part of Mann Library's Locale collection.,,Learning Object
oai:ecommons.cornell.edu:1813/40820,Agricultural marketing,,Contributing institution: University of Kentucky,,Learning Object
oai:ecommons.cornell.edu:1813/40821,Agroecosystems analysis,,Contributing institution: Iowa State University,,Learning Object
oai:ecommons.cornell.edu:1813/40822,Community food systems,,"Syllabus for University of Missouri's Agriculture 2215, Spring 2011",,Learning Object
oai:ecommons.cornell.edu:1813/40823,Agricultural marketing,,Previously hosted as part of Mann Library's Locale collection.,,Learning Object
oai:ecommons.cornell.edu:1813/40824,Biological pest management,,Previously hosted as part of Mann Library's Locale collection.,,Learning Object
oai:ecommons.cornell.edu:1813/40825,Bison 101 online training,,Previously hosted as part of Mann Library's Locale collection.,,Learning Object
oai:ecommons.cornell.edu:1813/40826,Food systems,,Contributing institution: University of California at Davis,,Learning Object
oai:ecommons.cornell.edu:1813/40827,Agroecology,,Contributing institution: Carleton College,,Learning Object
oai:ecommons.cornell.edu:1813/41244,Discovering Our Food System: Experiential Learning & Action for Youth and Their Communities,"Discovering our Food System (DFS) is an interdisciplinary, community-based exploration of the people and processes that shape our food system. Rooted in the places we live, eat, work, learn, and play, DFS will help youth better understand what the food system means to them, how it affects their community and their health, and ways in which they can influence the food system.

This iteration is an extensive revision of the original, which was published in 2000. Our primary audience is educators who work with youth ages 12-18. However, it is a framework and approach that is adaptable to a wide range of ages and educational settings, including:
    *students and teachers in a school-based classroom setting
    *home school students and their parent-teachers
    *school and community gardens
    *educational farms and environmental education centers
    *nutrition education and wellness programs
    *community and service-oriented groups, such as 4-H, Girl Scouts, Boy Scouts, etc.
    *after school programs
    *anyone who is curious about food, and wants to explore the varied ways it gets from farm to table, and how to get more involved in their food system.

Youth Grow is a youth leadership project for high-school aged youth in New York State that provides them with the training and tools to become leaders in creating sustainable local food systems. Youth Grow is still being completed; follow our progress here: http://blogs.cornell.edu/garden/get-activities/signature-projects/youth-grow/

The Cornell Garden-Based Learning program provides educators with inspiring, research-based gardening resources and professional development to support engaging, empowering, and relevant learning experiences for children, youth, adults, and communities. We are part of the Department of Horticulture and Cooperative Extension at Cornell University. More information about CGBL is available here: http://gardening.cce.cornell.edu",,,Learning Object
