oai:ecommons.cornell.edu:1813/2670,The Changing Nature of the Catalog and its Integration with Other Discovery Tools: Draft 2B,"This report, commissioned by the Library of Congress, analyzes research library catalogs and suggests options for their future. Includes a preliminary assessment of the feasibility of next steps and a blueprint for change. Structured interviews of noted library and information science professionals provide context for the recommendations.",,application/pdf,Preprint
oai:ecommons.cornell.edu:1813/7896,Analyzing Metadata for Effective Use and Re-Use,"Using a commercially available visual graphical analysis tool, the National Science Digital Library (NSDL) has developed techniques to expedite evaluation of large batches of metadata. These techniques allow efficient and thorough review of large quantities of XML metadata, thus enabling the focus of limited resources on evaluation and manipulation tasks that are most important in our
context. In the NSDL, metadata is evaluated for
aggregation, but these techniques are applicable to any situation where batches of metadata need to be evaluated. This paper discusses the motivations for this approach and the techniques themselves.",,application/pdf,Preprint
oai:ecommons.cornell.edu:1813/9371,Application Profiles: Exposing and Enforcing Metadata Quality,"In this paper, we explore a range of issues yet to be addressed in the large-scale use of application profiles.  While considerable attention has been paid to human-readable application profiles, there is a growing need for machine-readable application profiles that can support quality control mechanisms including, but not limited to, data validation.  We examine these issues in the context of the evolving Semantic Web and the DCMI commitment to RDF and the challenges presented.  We frame the discussion in terms of select functions to be served by application profiles and our notion of data profiles.  While much remains to be done to address these issues, positive movement toward solutions is dependent on the appropriate framing of those issues in terms of the needs of large-scale applications such as metadata aggregators.",,application/pdf,Preprint
oai:ecommons.cornell.edu:1813/10884,"Copyright Renewal, Copyright Restoration, and the Difficulty of Determining Copyright Status","It has long been known that most of the works published from 1923 to 1964 in the US are currently in the public domain.  Both non-profit and commercial digital libraries have dreamed of making this material available.  Most programs have recognized as well that the restoration of US copyright in foreign works in 1996 has made it impossible for them to offer to the public the full text of most foreign works.  What has been overlooked up to now is the difficulty that copyright restoration has created for anyone trying to determine if a work published in the United States is still protected by copyright.  This article discusses the impact that copyright restoration of foreign works has had on US copyright status investigations, and offers some of new steps that users must follow in order to investigate the copyright status in the US of any work.  It argues that copyright restoration has made it almost impossible to determine with certainty whether a book published in the United States after 1922 and before 1964 is in the public domain.  For digital libraries that wish to offer books from this period, they can do so at some risk.",D-Lib Magazine 13: 7/8 (July/August 2008) <http://www.dlib.org>,,Preprint
oai:ecommons.cornell.edu:1813/15188,Collaboration and Automation Support Cornell University Library’s Collection,"At Cornell, the use of a shared, web-based tool, has offered workflow improvements that have reduced the time required to provide library users with new books.  Kizer Walker from Collection Development and Scott Wicks from Technical Services share their experiences surrounding the development and use of this technology that facilitates the acquisitions of new books.",,,Preprint
oai:ecommons.cornell.edu:1813/17477,Challenges and Opportunities in Social Science Research Data Management,"With the necessity for developing better methods for the discovery and access of available research data, mounting pressure from funding agencies to make and keep research data accessible for the long term, and the complexity of the relationships of different types and formats of files involved in many studies, social science research data management has emerged as an area of multiple challenges and opportunities for information professionals.","Pre-print of paper to be published in the proceedings (http://dgd.de/pub_onlinetagung.aspx) of the conference ""Semantic Web & Linked Data - Elemente zukünftiger Informationsinfrastrukturen"" (1. DGI-Konferenz, 62. DGI Jahrestagung), held in Frankfurt, Germany from Oct. 7-9, 2010 (http://www.dgi-konferenz.de).",,Preprint
oai:ecommons.cornell.edu:1813/34461,Asymptotic Theory of Cepstral Random Fields,"Random fields play a central role in the analysis of spatially correlated data and, as a result,have a significant impact on a broad array of scientific applications. Given the importance of this topic, there has been a substantial amount of research devoted to this area. However, the
cepstral random field model remains largely underdeveloped outside the engineering literature.
We provide a comprehensive treatment of the asymptotic theory for two-dimensional random
field models. In particular, we provide recursive formulas that connect the spatial cepstral coefficients to an equivalent moving-average random field, which facilitates easy computation of the necessary autocovariance matrix. Additionally, we establish asymptotic consistency results for Bayesian, maximum likelihood, and quasi-maximum likelihood estimation of random field parameters and regression parameters. Further, in both the maximum and quasi-maximum likelihood frameworks, we derive the asymptotic distribution of our estimator. The theoretical results are presented generally and are of independent interest,pertaining to a wide class of random field models. The results for the cepstral model facilitate model-building: because the cepstral coefficients are unconstrained in practice, numerical optimization is greatly simplified,
and we are always guaranteed a positive definite covariance matrix.
We show that inference for individual coefficients is possible, and one can refine models in a disciplined manner. Finally, our results are illustrated through simulation and the analysis of straw yield data in an agricultural field experiment.",http://arxiv.org/pdf/1112.1977.pdf,,Preprint
oai:ecommons.cornell.edu:1813/37941,Time-changed extremal process as a random sup measure,"A functional limit theorem for the partial maxima of a long memory
stable sequence produces a limiting process that can be described as a 
beta-power time change in the classical Fr\'echet 
extremal process, for beta in a subinterval of the unit
interval. Any such power time change  in the extremal process 
for 0<beta<1 produces a process with stationary
max-increments. This deceptively simple time change hides the much
more delicate structure of the resulting process as a self-affine
random sup measure. We uncover this structure and show that in a
certain range of the parameters this random measure arises as a limit
of the partial maxima of the same  long memory stable sequence, but in
a different space. These results open a way to construct a whole new
class of self-similar Fr\'echet processes with stationary
max-increments.",,,Preprint
oai:ecommons.cornell.edu:1813/37987,Fast Near Neighbor Search in High-Dimensional Binary Data,"Numerous applications in search, databases, machine learning,
and computer vision, can benefit from efficient algorithms for near
neighbor search. This paper proposes a simple framework for fast near
neighbor search in high-dimensional binary data, which are common in
practice (e.g., text). We develop a very simple and effective strategy for
sub-linear time near neighbor search, by creating hash tables directly
using the bits generated by b-bit minwise hashing. The advantages of
our method are demonstrated through thorough comparisons with two
strong baselines: spectral hashing and sign (1-bit) random projections.",,,Preprint
oai:ecommons.cornell.edu:1813/37986,b-Bit Minwise Hashing in Practice,"Minwise hashing is a standard technique in the context of search for
approximating set similarities. The recent work [26, 32] demon-
strated a potential use of b-bit minwise hashing [23, 24] for ef-
ficient search and learning on massive, high-dimensional, binary
data (which are typical for many applications in Web search and
text mining). In this paper, we focus on a number of critical is-
sues which must be addressed before one can apply b-bit minwise
hashing to the volumes of data often used industrial applications.",,,Preprint
oai:ecommons.cornell.edu:1813/39077,Climbing down Gaussian  peaks,"How likely is the high level of a continuous Gaussian random field on
an Euclidean space  to
have a ``hole'' of a certain dimension and depth? Questions of this
type are difficult, but in this paper we make progress on questions
shedding new light in existence of holes. How likely is the field to
be above a high level on one compact set (e.g. a sphere) and to be
below a fraction of that level on some other compact set, e.g. at the
center of the corresponding ball? How likely is the field to be below that
fraction of the level anywhere nside the ball? We work on the
level of large deviations.",,,Preprint
oai:ecommons.cornell.edu:1813/39081,Revisiting the Economics of Privacy: Population Statistics and Confidentiality Protection as Public Goods,"We consider the problem of the public release of statistical information about a population–explicitly accounting for the public-good properties of both data accuracy and privacy loss. We first consider the implications of adding the public-good component to recently published models of private data publication under differential privacy guarantees using a Vickery-Clark-Groves mechanism and a Lindahl mechanism. We show that data quality will be inefficiently under-supplied. Next, we develop a standard social planner’s problem using the technology set implied by (ε, δ)-differential privacy with (α, β)-accuracy for the Private Multiplicative Weights query release mechanism to study the properties of optimal provision of data accuracy and privacy loss when both are public goods. Using the production possibilities frontier implied by this technology, explicitly parameterized interdependent preferences, and the social welfare function, we display properties of the solution to the social planner’s problem. Our results directly quantify the optimal choice of data accuracy and privacy loss as functions of the technology and preference parameters. Some of these properties can be quantified using population statistics on marginal preferences and correlations between income, data accuracy preferences, and privacy loss preferences that are available from survey data. Our results show that government data custodians should publish more accurate statistics with weaker privacy guarantees than would occur with purely private data publishing. Our statistical results using the General Social Survey and the Cornell National Social Survey indicate that the welfare losses from under-providing data accuracy while over-providing privacy protection can be substantial.",,,Preprint
oai:ecommons.cornell.edu:1813/39193,Emergence and definitions of digital libraries,"This chapter of Exploring Digital Libraries traces the first decade of progress in digital libraries (1991-2001), with emphasis on the foundational innovations, vision, motivations, new technology, funding and early programs that prompted their emergence and rapid development. It next turns to the question of how to define the concept of “digital libraries” in an environment of multiple perspectives and continuous technological and societal change. The chapter’s intent is to orient the reader to the field as well as to ground the rest of the book in the context of the aspirations and efforts of many diverse communities and individuals.","This is a preprint of a chapter whose final and definitive form was co-published in Exploring Digital Libraries: Foundations, Practice, Prospects by Facet Publishing (2014) and ALA Neal-Schuman (2014).",,Preprint
oai:ecommons.cornell.edu:1813/39194,Outcomes of digital libraries' first decade,"This chapter of Exploring Digital Libraries identifies and discusses a set of significant outcomes from the first decade of digital library research and practice (1991 to 2001). It describes accomplishments that set the dominant themes and continue to shape the field of digital libraries today. The chapter’s overall purpose is to offer a framework for understanding the productive work of thousands of people during that period, one that reveals the interplay of people (producers and providers of digital libraries); enabling technologies; and the collections, services and communities they support.","This is a preprint of a chapter whose final and definitive form was co-published in Exploring Digital Libraries: Foundations, Practice, Prospects by Facet Publishing (2014) and ALA Neal-Schuman (2014).",,Preprint
oai:ecommons.cornell.edu:1813/39195,Key themes and challenges in digital libraries,"This chapter provides a high-level view of the key themes, current position and challenges of digital libraries and their technologies, social aspects, collections and communities. It begins by identifying the key themes of the second decade (2002-2012) of progress in the diverse, multidisciplinary, international field of digital libraries. A concept map visualizes the results of an analysis of second-decade digital library literature. The map provides new insights into this complex field by exposing thematic connections between technologies, collections, social forces and online community building. The chapter concludes with a consideration of key challenges facing digital libraries: interoperability, community engagement, intellectual property rights, and sustainability.","This is a preprint of a chapter whose final and definitive form was co-published in Exploring Digital Libraries: Foundations, Practice, Prospects by Facet Publishing (2014) and ALA Neal-Schuman (2014).",,Preprint
oai:ecommons.cornell.edu:1813/39196,Digital library collections: repositories,"This chapter and the next discuss digital libraries and the web through the lens of collections and collection building. This chapter begins with an exploration of the parallel but separate developments of the web, digital library repositories, and hybrid libraries. It then turns to an examination of digital library repositories. Topics include numbers, usage, and discoverability of repositories; current position and roles; systems and software; federation and dissemination of repository content; next generation repository systems; and cyberinfrastructure, data and e-research support. The next chapter moves on to the examination of hybrid libraries, then concludes with thoughts about advances, opportunities and challenges for both hybrid libraries and repositories.","This is a preprint of a chapter whose final and definitive form was co-published in Exploring Digital Libraries: Foundations, Practice, Prospects by Facet Publishing (2014) and ALA Neal-Schuman (2014).",,Preprint
oai:ecommons.cornell.edu:1813/39197,Hybrid libraries,"This chapter of Exploring Digital Libraries continues the discussion of digital collections with a detailed look at the interplay between library users, hybrid library collections and enabling technologies for hybrid library systems and services. Hybrid library collections contain non-digital, digitized and born digital resources. This chapter examines changing information-seeking behaviors and preferences, explores how they have fostered new collections strategies, and analyses the impact of both on discovery services and other enabling technologies for hybrid libraries. The chapter ends with some thoughts about the parallel but separate evolutionary paths of hybrid libraries, repositories and the web.","This is a preprint of a chapter whose final and definitive form was co-published in Exploring Digital Libraries: Foundations, Practice, Prospects by Facet Publishing (2014) and ALA Neal-Schuman (2014).",,Preprint
oai:ecommons.cornell.edu:1813/39198,Social roles of digital libraries,"This chapter of Exploring Digital Libraries examines the social value of digital libraries. It begins by exploring past and present understandings of the value of libraries to their communities. Taking a well-known framework that lays out libraries’ social roles as a starting point, the chapter then suggests a possible new framework to describe the social roles of digital libraries. The remainder of the chapter explicates this potential framework, exploring aspects of each social role. The sections offer examples, consider benefits and challenges, and draw attention to key readings from digital library researchers and practitioners.","This is a preprint of a chapter whose final and definitive form was co-published in Exploring Digital Libraries: Foundations, Practice, Prospects by Facet Publishing (2014) and ALA Neal-Schuman (2014).",,Preprint
oai:ecommons.cornell.edu:1813/39201,Digital libraries and their communities,"What sets thriving, long-lived digital libraries apart from those that attract only modest attention or have faded into memory? Why have some digital libraries had a distinctive impact on the communities they were built to serve, while others are more or less ignored? This chapter of Exploring Digital Libraries examines these issues. It builds on table 2.1’s descriptions of a sample of working digital libraries that have been successful since they began in the first decade of digital libraries (1991-2001). It also takes up themes from chapter 6, which examines the ways that digital libraries produce, or could produce value for the communities they serve.","This is a preprint of a chapter whose final and definitive form was co-published in Exploring Digital Libraries: Foundations, Practice, Prospects by Facet Publishing (2014) and ALA Neal-Schuman (2014).",,Preprint
oai:ecommons.cornell.edu:1813/39203,The prospects of open access repositories,"This chapter of Exploring Digital Libraries focuses on the potential of open access repositories for having a distinctive positive impact on scholarship and, more broadly, on their prospects for increasing the social and economic value of digital libraries. In addition to extending chapter 4’s discussion of open access repositories into new territory, it relates the frameworks presented in chapters 6 and 7 to this particular type of digital library. Topics include subject-based and institutional repositories and their value; issues around recruiting repository content, including deposit mandates; legal frameworks, copyright and open access; discipline-specific norms, practices and reward systems; the discoverability of scholarly content; sustainability of repositories; e-research data management; and prospects for the emergence of a global ecosystem of repositories.","This is a preprint of a chapter whose final and definitive form was co-published in Exploring Digital Libraries: Foundations, Practice, Prospects by Facet Publishing (2014) and ALA Neal-Schuman (2014).",,Preprint
oai:ecommons.cornell.edu:1813/39205,Digital libraries and the social web: scholarship,"This chapter of Exploring Digital Libraries is the first of two that consider the responses of digital libraries to the social web and to web-based practices for information seeking, learning, teaching, research, professional recognition, work, recreation and socializing. Both chapters elaborate on ideas introduced in chapters 3 to 8. This chapter’s first part examines the origins and chaotic, fast-moving nature of the social web, explores the possibility of digital libraries as social platforms, and introduces a visual framework that attempts to bring some coherence to the many confusing elements of digital libraries’ evolution toward the social web. The second part of the chapter turns to the branches of the visual framework that pertain to the social web’s existing, emergent, or potential impacts on scholarship, research and researchers.","This is a preprint of a chapter whose final and definitive form was co-published in Exploring Digital Libraries: Foundations, Practice, Prospects by Facet Publishing (2014) and ALA Neal-Schuman (2014).",,Preprint
oai:ecommons.cornell.edu:1813/39206,Digital libraries and the social web: collections and platforms,"This chapter of Exploring Digital Libraries continues the consideration of digital libraries’ responses to the social web. It builds on the visual framework introduced in chapter 9 to consider the transition of digital collections to platforms that align well with how people find information, work and play on the social web; are highly visible and invite interaction; and re-mix and re-use data from other sources. The chapter closes with some thoughts about future digital libraries and libraries’ digital future.","This is a preprint of a chapter whose final and definitive form was co-published in Exploring Digital Libraries: Foundations, Practice, Prospects by Facet Publishing (2014) and ALA Neal-Schuman (2014).",,Preprint
oai:ecommons.cornell.edu:1813/40306,Modeling Endogenous Mobility in Wage Determination,"We evaluate the bias from endogenous job mobility in fixed-effects estimates of worker- and firm-specific earnings heterogeneity using longitudinally linked employer-employee data from the LEHD infrastructure file system of the U.S. Census Bureau. First, we propose two new residual diagnostic tests of the assumption that mobility is exogenous to unmodeled determinants of earnings. Both tests reject exogenous mobility. We relax the exogenous mobility assumptions by modeling the evolution of the matched data as an evolving bipartite graph using a Bayesian latent class framework. Our results suggest that endogenous mobility biases estimated firm effects toward zero. To assess validity, we match our estimates of the wage components to out-of-sample estimates of revenue per worker. The corrected estimates attribute much more of the variation in revenue per worker to variation in match quality and worker quality than the uncorrected estimates.",,,Preprint
oai:ecommons.cornell.edu:1813/40581,Economic Analysis and Statistical Disclosure Limitation,"This paper explores the consequences for economic research of methods used by data publishers to protect the privacy of their respondents. We review the concept of statistical disclosure limitation for an audience of economists who may be unfamiliar with these methods. We characterize what it means for statistical disclosure limitation to be ignorable. When it is not ignorable, we consider the effects of statistical disclosure limitation for a variety of research designs common in applied economic research. Because statistical agencies do not always report the methods they use to protect confidentiality, we also characterize settings in which statistical disclosure limitation methods are discoverable; that is, they can be learned from the released data. We conclude with advice for researchers, journal editors, and statistical agencies.",,,Preprint
oai:ecommons.cornell.edu:1813/40828,A New Method for Protecting Interrelated Time Series with Bayesian Prior Distributions and Synthetic Data,"Organizations disseminate statistical summaries of administrative data via the Web for unrestricted
public use. They balance the trade-off between confidentiality protection and inference quality. Recent developments
in disclosure avoidance techniques include the incorporation of synthetic data, which capture the essential features
of underlying data by releasing altered data generated from a posterior predictive distribution. The United States
Census Bureau collects millions of interrelated time series micro-data that are hierarchical and contain many zeros
and suppressions. Rule-based disclosure avoidance techniques often require the suppression of count data for small
magnitudes and the modification of data based on a small number of entities. Motivated by this problem, we use
zero-inflated extensions of Bayesian Generalized Linear Mixed Models (BGLMM) with privacy-preserving prior
distributions to develop methods for protecting and releasing synthetic data from time series about thousands of small
groups of entities without suppression based on the of magnitudes or number of entities. We find that as the prior
distributions of the variance components in the BGLMM become more precise toward zero, confidentiality protection
increases and inference quality deteriorates. We evaluate our methodology using a strict privacy measure, empirical
differential privacy, and a newly defined risk measure, Probability of Range Identification (PoRI), which directly
measures attribute disclosure risk. We illustrate our results with the U.S. Census Bureau’s Quarterly Workforce
Indicators.",,,Preprint
