oai:ecommons.cornell.edu:1813/13449,A biography of and interview about Isidor I. Sprecker,"The son of Russian Jews who had fled to the United States to avoid persecution, Isidor Sprecher (he later changed his name to Sprecker for ease of pronunciation) was one of 40 graduates in Cornell's veterinary class of 1939. He initially practiced in Derby, Connecticut, then was called into service in the US British West Indies during WWII. Returning to Connecticut following the war, he opened a small animal practice in Waterbury. His deep devotion to veterinary education and research led him and his wife, Sylvia, to bestow upon Cornell a series of gifts that culminated in their being named Foremost Benefactors of the university. The Spreckers retired in Boynton Beach, Florida, where Isidor died in 2004 at age 90.","Person interviewed: Mrs. Sylvia Sprecker, wife of Isidor I. Sprecker.  Interviewer: Smith, Donald F.  Interview date: January 22, 2008.  Interview location: Delray Beach, FL.  Date biography was written:  June 15, 2009.",,Sound
oai:ecommons.cornell.edu:1813/14158,"Interview recording about: Louis J. Camuti, DVM","Interview of Ms. Nina Danielson about Louis J. Camuti, DVM, Class of 20.  Interview Date: December 7, 2007.  Interviewer: Donald F. Smith, DVM, Austin O. Hooey Dean Emeritus.",,,Sound
oai:ecommons.cornell.edu:1813/17395,"Interview with Claudia Verhoeven, May 13, 2010","Interview with Claudia Verhoeven, Assistant Professor of History at Cornell University, conducted in Ithaca, NY on May 13, 2010. Professor Verhoeven is author of ""The Odd Man Karakazov: Imperial Russia, Modernity and the Birth of Modern Terrorism,"" published by Cornell University Press in 2009.","Interview Themes: What Verhoeven hoped to achieve with The Odd Man Karakazov (00:58)
Greatest challenge of writing the book (10:02)
How historians learn to recognize the new in history (16:29)
Primary influences on Verhoeven's research and writing thus far (24:44)
Implications of Verhoeven's work for the field of Russian history (31:38)
Recent works published that suggest what is interesting now (38:00)
Verhoeven's plans for future research (40:05)",,Sound
oai:ecommons.cornell.edu:1813/13739,"Interview with Alison Frank, September 25, 2009","Interview with Alison Frank, John L. Loeb Associate Professor of the Social Sciences at Harvard University. Interview conducted in Ithaca, NY on September 25, 2009. Professor Frank is the author of a number of articles and an excellent book on the oil industry in the Habsburg Monarchy entitled Oil Empire: Visions of Prosperity in Austrian Galicia. She is now working on a project on the coastline of Austria-Hungary.","Interview Themes: How Frank chooses research topics (00:50)
Aspects of her training as a historian Frank found useful (07:00)
Books that have inspired and informed Frank's work (11:11)
On the role of area studies for scholarship on East-Central Europe (14:00)
""Internationalizing"" the history of East-Central Europe (19:30)
Advice to young historians/scholars working on the region (22:11)",,Sound
oai:ecommons.cornell.edu:1813/13971,The College on Wheels and Post World War II Home Makeovers,,"Karen Dunn-Haley, 2007 recipient of the College of Human Ecologys History of Home Economics Fellowship, examines the history of post-War Cornell extension demonstration trains and their impact in bringing principles of modern home design into the everyday life of American households.",,Sound
oai:ecommons.cornell.edu:1813/14078,"A Growing College, redux: When Home Economics Became Human Ecology - Audio","In 1969, after 5 years of deliberation and planning, Cornell's College of Home Economics became the College of Human Ecology. Gwen Kay, Associate Professor of History at SUNY Oswego and 2008 recipient of the Cornell CHE Fellowship in the History of Home Economics, examines how and why the new name came into being, and what the hopes were for the new college.",,,Sound
oai:ecommons.cornell.edu:1813/14162,"Interview recording about: Clarence R. Roberts, DVM","Interview of Dr. Kent Roberts about Clarence R. Roberts, DVM, Class of 1922.  Interview Date: January 20, 2008.  Interviewer: Donald F. Smith, DVM, Austin O. Hooey Dean Emeritus.",,,Sound
oai:ecommons.cornell.edu:1813/14194,"Interview recording: Clarence F. Bent, DVM","Interview of Clarence F. Bent, DVM, Class of 1939.  Interview Date: July 1, 2008.  Interviewer: Donald F. Smith, DVM, Austin O. Hooey Dean Emeritus.",,,Sound
oai:ecommons.cornell.edu:1813/14195,A biography of and interview with Clarence F. Bent,"Clarence Bent was one of six students in the Cornell DVM Class of 1939 not from New York State. He was raised on a poultry farm in New Hampshire and attended the UNH before matriculating in veterinary medicine at Cornell in 1935. His first job after graduation was at the Rowley Memorial Animal Hospital in Springfield, Massachusetts, a branch of Bostons renowned Angell Memorial Hospital. Here Dr. Bent developed his small animal medical skills before starting his own veterinary practice in New Hampshire. He was deployed as a commissioned officer of the U.S. Army Veterinary Corps following the attack on Pearl Harbor.  He fulfilled his war service as meat inspector, first in Massachusetts, then in Papua New Guinea and the Philippines.  Following the war, he opened a small animal clinic in Nashua, New Hampshire. He served as president of the New Hampshire Veterinary Association. He retired in 1974 and currently lives in Derry in the home of one of his two children.","Person interviewed: Clarence F. Bent.  Interviewer: Smith, Donald F.  Interview date: July 1, 2008.  Interview location: Derry, New Hampshire.  Date biography was written:  October 2009.",,Sound
oai:ecommons.cornell.edu:1813/14196,A biography of and interview about Clarence R. Roberts,"Clarence R. Roberts went from general veterinary practitioner in rural New York State to chief executive officer of a major dairy corporation. He received his DVM degree from Cornell University in 1922 when tuberculosis was still a prevalent disease transmitted to people drinking unpasteurized milk from infected cows. To provide for his growing family, Roberts accepted a position with Sheffield Farms Company where he examined dairy cattle and milking facilities from farms that supplied milk for human consumption. In 1929, he was promoted to a management position in New York City. He continued moving up the corporate ladder, first as President of Sheffield Farms, and eventually becoming CEO of Sealtest Foods, the milk and ice cream division of National Dairy Corporation, where he supervised 20,000 people. Though required to retire at age 65, he remained active in local activities and Cornell alumni affairs until his death in his 100th year. Dr. and Mrs. Roberts have three children, including Dr. Kent Roberts, also a veterinarian.","Person interviewed: Dr. Kent Roberts, son to Clarence R. Roberts.  Interviewer: Smith, Donald F.  Interview date: January 20, 2008.  Interview location: Orlando, Florida.
Date biography was written:  October, 2009.",,Sound
oai:ecommons.cornell.edu:1813/14197,A biography of and interview about Louis J. Camuti,"Louis J. Camuti was the first exclusive feline veterinarian. He was raised in New York City by Italian immigrants and studied at Cornell University before receiving his veterinary degree in 1920 from the now-defunct New York University Veterinary College. He developed a small animal practice in nearby Westchester County, then established a second clinic on Park Avenue in Manhattan. As the feline portion of his practice increased, he developed an ambulatory component and eventually worked exclusively as a house-call feline practitioner throughout the city. Dr. Camuti was an effective spokesperson for the cat, writing articles and making numerous media appearances. He authored two popular books about his life as a feline veterinarian: Park Avenue Vet, and All My Patients Are under the Bed. For many years, he also wrote a monthly column in the veterinary journal, Feline Practice. His legacy is honored at Cornell Universitys Feline Health Center where the consultation service is named in his honor.","Person interviewed: Nina C. Danielsen. Daughter of Louis J. Camuti.  Interviewer: Smith, Donald F.  Interview date: December 7, 2007.  Interview location: Hightstown, New Jersey.  Date biography was written: October 2009.",,Sound
oai:ecommons.cornell.edu:1813/14200,"Interview recording: Kenneth I. Gumaer, DVM","Interview of Kenneth I. Gumaer, Sr., DVM, Class of 1943.  Interview Date: October 15, 2007.  Interviewer: Donald F. Smith, DVM, Austin O. Hooey Dean Emeritus.  Additional participant: Richard Drumm, DVM.",,,Sound
oai:ecommons.cornell.edu:1813/14205,"A biography of and interview with Kenneth I. Gumaer, Sr.","Shortly after receiving his Cornell DVM in 1943, Kenneth Gumaer was charged with the care of 267 mules bound for the China-Burma-India campaign on a warship that departed from New Orleans. Though the ship was damaged by a torpedo from a German U-boat and had to be repaired before a very stormy Atlantic crossing, Gumaer and his mules eventually arrived safely in Calcutta. They became part of the long range penetration special forces unit known as Merrill's Marauders that traversed the dense Burmese jungle and the Kuman Mountain range behind Japanese lines. Remaining in China following the campaign, Gumaer contracted cutaneous anthrax after a post mortem examination of an officer's mule that had died acutely. Though critically ill, he was successfully treated with the then-experimental aqueous form of penicillin. Following the war, Gumaer established a large animal practice in Rhinebeck, New York. Later in his career, he worked as a research pathologist for Sterling Winthrop Research Institute in Rensselaer, New York. Dr. Gumaer and his wife, Catherine, were named Foremost Benefactors of Cornell University in 1998. They have three children, one of whom, Kenneth I. Gumaer, Jr., is a veterinarian.","Person interviewed: Kenneth I. Gumaer, Sr.  Other participants: Drumm, Richard, DVM.  Interviewer: Smith, Donald F.  Interview date: October 15, 2007.  Interview location: Stuyvesant Falls, New York.  Date biography was written:  November 2009.",,Sound
oai:ecommons.cornell.edu:1813/15132,A biography of and interview with Linda Dixon Reeve (Peddie),"Though Cornells College of Veterinary Medicine usually admitted only two women per year during the 1950s and 1960s, Linda Dixon Reeve was the only woman in her veterinary class of 1965. Her interviewshe more aptly described it as an inquisitionwas typical of the selection process for women in that era. Being a land grant college, Cornell was concerned that students understand the priority placed upon large animal practice, and the interviewing faculty spent a great deal of effort in determining whether candidates personal obligations like marriage and family were likely to became a distraction from that priority. Dr. Reeve did, in fact, marry a classmate, James Peddie, and they moved to California following graduation. Much of her career was spent at the Conejo Valley Veterinary Clinic in Thousand Oaks, where she practiced on companion animals as well as a variety of animals (elephants, primates, large cats, and others) used in Hollywood as animal actors.","Person interviewed: Linda Dixon Reeve (Peddie).  Interviewer: Smith, Donald F.   Interview date: February 16, 2010.  Interview location: Western Veterinary Conference, Las Vegas, Nevada.  Date biography was written:  May, 2010.",,Sound
oai:ecommons.cornell.edu:1813/15131,"Interview recording: Linda Dixon Reeve (Peddie), DVM","Interview of Linda Dixon Reeve (Peddie), DVM. Class of 1965.  Interview Date: February 16, 2010.  Interviewer: Donald F. Smith, DVM, Austin O. Hooey Dean Emeritus.",,,Sound
oai:ecommons.cornell.edu:1813/15143,"Interview recording:  Morris L. Povar, DVM","Interview of Morris L. Povar, DVM, Class of 1944.  Interview Date: April 28, 2010.  Interviewer: Donald F. Smith, DVM, Austin O. Hooey Dean Emeritus.",,,Sound
oai:ecommons.cornell.edu:1813/15144,"Interview recording about: Marie Koenig Olson, DVM","Interview of Ann Marie Olson and Dr. James K. Olson about Marie Koenig Olson, DVM, Class of 1937.  Interview Date: November 30, 2007.  Interviewer: Donald F. Smith, DVM, Austin O. Hooey Dean Emeritus.",,,Sound
oai:ecommons.cornell.edu:1813/15200,A biography of and interview with Morris L. Povar,"Morris L. Povar was born of Russian immigrants in New York City. He attended Brooklyn College before matriculating at Cornell University, first in agriculture, then in veterinary medicine. He received his DVM in 1944. After completing his World War II commitment in the Veterinary Corps, Morris joined his brother, Ralph Povar 39, in Rhode Island and together they built a practice that exists to this day as the Povar Animal Hospital. In 1970, Dr. Povar was appointed to a tenured faculty position at Brown University, where he served in the Psychology Department and in the School of Medicine. He and his wife, Lotte Povar, have two children and are now retired in Boca Raton, Florida.","Person interviewed: Morris L. Povar.  Other participants: Mrs. Lotte Povar, wife.  Interviewer: Smith, Donald F.  Interview date: April 28, 2010.   Interview location: Boca Raton, Florida.  Date biography was written:  April, 2010.",,Sound
oai:ecommons.cornell.edu:1813/15211,A biography of and interview about Marie Koenig Olson,"Marie Koenig was born in Ithaca, New York, when her father, Frederick F. Koenig (DVM 1909) was a faculty member at Cornell University. While Marie was a young girl, the family moved to nearby Jamestown and Dr. Koenig opened a general veterinary practice. Marie followed in her fathers footsteps and became the seventh woman veterinary graduate from Cornell in 1937. After a year working in a small animal practice in Rochester, Marie joined her fathers practice where she performed both small animal and large animal work.  She took over the practice after her fathers retirement and simultaneously raised her two children while her husband, Raymond Olson, was stationed overseas during World War II. Ray returned to college after the war and graduated with a DVM in 1957, 20 years after his wife. Together, they build a modern small animal hospital in Jamestown and Dr. Koenig Olson continued to practice to the day she died in 1970, at age 57. Her son and granddaughter also became veterinarians in 1973 and 2009, respectively, bringing the family legacy to four generations over one hundred years.","Persons interviewed: Ann Marie Olson, daughter and James K. Olson, son.  Interviewer: Smith, Donald F.  Interview date: November 30, 2007.
Interview location: Cornell University College of Veterinary Medicine.  Date biography was written:  June 2010.",,Sound
oai:ecommons.cornell.edu:1813/17031,"Interview recording: Carolyn Foster Comans, DVM","Interview of Carolyn Foster Comans, DVM, Class of 1960.  Interview Date: June 11, 2010.  Interviewer: Donald F. Smith, DVM, Austin O. Hooey Dean Emeritus.",,,Sound
oai:ecommons.cornell.edu:1813/17032,A biography of and interview with Carolyn Foster Comans,"A native of Western New York, Carolyn (Lyn) Foster Comans was a member of the last class that matriculated in Cornells old James Law Hall and associated veterinary buildings on central campus. In their second year (1957), the students moved into spacious new facilities on the east end of campus that are still an important part of the veterinary complex. Despite the gender discrimination that was common in that era, Lyn had good rapport with her male classmates and most of the faculty. After graduating in 1960, she worked in a small animal clinic in Buffalo, N.Y.  She met and married Dr. Edmond Comans 59 the following year, and they moved to Long Island and built the St. James Animal Hospital. Dr. Comans developed a strong clinical interest in pet avian practice, and later, acupuncture. Since selling the practice and moving to central Florida in 2001, she continues to run a part-time acupuncture practice. Throughout much of her career, she has been an active Cornell supporter, contributing generously with her time, leadership abilities and resources.","Person interviewed: Carolyn Foster Comans.  Interviewers: Smith, Donald F. and Morrissey, Jennifer K.  Interview date: June 11, 2010.  Interview location: Cornell University College of Veterinary Medicine.  Date biography was written:  July, 2010.",,Sound
oai:ecommons.cornell.edu:1813/17051,"Interview recording:  Patricia Thomson Herr, DVM","Interview of Patricia Thomson Herr, DVM, Class of 1960.  Interview Date: June 12, 2010.  Interviewers: Donald F. Smith, DVM, Austin O. Hooey Dean Emeritus and Dana Peirce.",,,Sound
oai:ecommons.cornell.edu:1813/17052,A biography of and interview with Patricia Thomson Herr,"Patricia Thomson is one of three women who graduated in Cornells veterinary class of 1960. Originally from Schenectady, N.Y., Trish entered Cornells agriculture program as a pre-veterinary student in fall 1954 and matriculated in the veterinary program two years later. Dr. Thomsons first job after graduation was with Dr. Joseph Engle 26 in Summit, New Jersey. Engle was a leading small animal veterinarian of the time and a founder of the American Animal Hospital Association. Dr. Thomson returned to Cornell in 1962 and served for one year as small animal interne. She married Dr. Donald Herr 63, and they eventually moved to Lancaster, Pennsylvania, where they built and operated the Manheim Pike Veterinary Hospital. Dr. Thomson became the first woman president of the Pennsylvania Veterinary Medical Association. She has been active on various Cornell University activities and is an avid decorative arts historian and author.","Person interviewed: Patricia Thomson Herr.  Interviewers:  Smith, Donald F. and Peirce, Dana.  Interview date: June 12, 2010.  Interview location:  Cornell University College of Veterinary Medicine.  Date biography was written:  July 2010.",,Sound
oai:ecommons.cornell.edu:1813/17323,Managing Change Brown Bag Lunch,"Cornell is going through what will perhaps be the most transformative time in its history. Budgets, organizational structures, staffing, and many other issues are all under close examination as the university positions itself for the future.

Vice President for Human Resources Mary George Opperman and Vice President for Planning and Budget Elmira Mangum discuss managing change in uncertain times.",,,Sound
oai:ecommons.cornell.edu:1813/21951,"Interview with Elizabeth McGuire, September 30, 2010","Interview with Elizabeth McGuire, Ph.D. UC Berkeley (2010) and currently academy scholar at the Harvard Academy of International and Area Studies. Interview conducted in Ithaca, NY on September 30, 2010. The title of Dr. McGuire's book manuscript is ""The Sino-Soviet Romance: How Chinese Communists Fell in Love with Russia, Russians, and the Russian Revolution.""","Interview Themes: How McGuire came to her dissertation topic (00:43)
How the macro links to the micro in the history of the Sino-Soviet romance (03:14)
Practical challenges of writing transnational history across area studies boundaries (05:52)
McGuire's approach to narrative in her work (09:17)
The work of the historian in a post-area-studis world (11:33)
On training grad students to think transnationally (14:30)
Projects that can be undertaken with knowledge of Russian and Chinese (17:23)
Primary intellectual influences on McGuire (21:52)",,Sound
oai:ecommons.cornell.edu:1813/17403,Why Muslim Women Must Reinterpret the Qur'an,"Nimat Hafez Barazangi, Ph.D. '88, a research fellow in the Feminist, Gender and Sexuality Studies program at Cornell, suggests it's time for Muslim women to have a peaceful, silent revolution firmly grounded in the Qur'an. Barazangi works to improve attitudes and conditions for women in Islam. She is the author of ""Woman's Identity and the Qur'an.""
The lecture, moderated by National Public Radio correspondent Laura Sydell, was recorded in front of a live audience at The Commonwealth Club in San Francisco on July 19, 2010. A podcast is included and a video can be accessed from the link below.",,,Sound
oai:ecommons.cornell.edu:1813/17470,"Interview recording: Robert E. Lynk, DVM","Interview of Robert E. Lynk, DVM, Class of 1961.  Interview Date: September 10, 2010.  Interviewer: Donald F. Smith, DVM, Austin O. Hooey Dean Emeritus.",,,Sound
oai:ecommons.cornell.edu:1813/17471,A biography of and interview with Robert E. Lynk,"Robert E. Lynk was born into a farming family in Schoharie County. Anticipating a life in agriculture, he received his B.S. from Cornell University in 1954. After his marriage to an alumna of Cornell and a 16-month tour of duty in Korea, Bob joined the veterinary Class of 1961, the first cohort of students to matriculate in the new veterinary complex at the eastern end of the Cornell campus. Following graduation, he joined the general practice of Dr. Thomas Vaughn, first in Clarksville, and later in Delmar, New York. Dr. Lynk remained in this practice throughout his professional career, retiring in 1997 to an active life of painting, bowling, and Church activities. Throughout his career, Dr. Lynk has held several offices within the veterinary society at both regional and state levels. He and his wife, Nancy, are quintessential Cornell supporters, active in alumni and other events.","Person interviewed: Robert E. Lynk.  Interviewer: Smith, Donald F.  Interview date: September 10, 2010.  Interview location: Crystal Lake, near Rensselaerville, New York. Date biography was written:  September 2010.",,Sound
oai:ecommons.cornell.edu:1813/17474,Memorial to Richard N. White (1933-2009),"Richard Dick N. White, the James A. Friend Family Distinguished Professor of Engineering Emeritus of the School of Civil and Enviromnental Engineering (CEE), died at the age of 75. He was one of Cornells most distinguished faculty members for 38 years until his retirement in 1999. Among his numerous appointments and positions at Cornell, he most notably served as Director of the School of CEE (1978-84) and as Associate Dean for Undergraduate Programs of the College of Engineering (1987-90). He was elected a member of the National Academy of Engineering in 1992 and was an Honorary Member of two prominent national civil engineering societies, the American Society of Civil Engineers (ASCE) and the American Concrete Institute (ACI). He was particularly active in the latter and served as its President in 1997-98.

He joined the CEE faculty in 1961 and rapidly developed a versatile research program to complement his teaching of undergraduate and graduate courses. Although his research interests spanned all the traditional areas of structural engineering  experimental. analytical and computer approaches to concrete, steel and timber structures  he held a special love for topics in concrete and for structural model studies. In support of the last, he led the creation and use of a structural models lab for both instruction and research that was one of the finest in the nation. Among his many publications, he was the senior author of a remarkably successful set of textbooks, Structural Engineering, a three-volume series that integrated aspects of mechanics, analysis, behavior, materials and design  and also disseminated widely the essence of the Cornell CEE undergraduate curriculum in structures.

This entry includes Dicks CV, the statement for the annual university faculty memorial booklet, and a video recording of the memorial gathering held on May 1, 2010.",,,Sound
oai:ecommons.cornell.edu:1813/17795,"Interview recording:  Proctor, Delano L. Jr., DVM","Interview of Delano L. Proctor, Jr., DVM, Class of 1942.  Interview Date: December 18, 2007.  Interviewer: Donald F. Smith, DVM, Austin O. Hooey Dean Emeritus.",,,Sound
oai:ecommons.cornell.edu:1813/17796,"A biography of and interview with Delano L. Proctor, Jr.","Delano L. Proctor, Jr. grew up in Lexington, Kentucky, the son of an equine practitioner. He was assigned to the Veterinary Corps following his graduation from Cornell in 1942. He fulfilled over three years of service in India, preparing mules and horses for the rugged China-Burma-India campaign. Following his discharge in 1946 at the rank of captain, he returned to his fathers veterinary practice where he had a distinguished career as equine veterinarian, board-certified surgeon, and advocate for the profession. He was devoted to the development of the profession at many levels, including serving as A.V.M.A. president in 1985-86. Dr. Proctor had a great admiration for his alma mater, Cornell University, and also had a special affinity for the history of veterinary medicine. He died at age 91 in 2009.","Person interviewed: Delano L. Proctor, Jr.  Interviewer: Smith, Donald F.  Interview date: December 18, 2007.  Interview location: Lexington, Kentucky.  Date biography was written:  October 2010.",,Sound
oai:ecommons.cornell.edu:1813/19154,"Religion and culture - the nature of religion: an introduction; Cornell University lecture, Natural Resources  407 (2010-11-18)",Introduction: Religion and culture - the nature of religion; personal stories,,,Sound
oai:ecommons.cornell.edu:1813/19155,"Environmental studies - theory vs. specifics,; Cornell University lecture, Natural Resources  407 (2010-11-18)","Environmental studies - theory vs. specifics,",,,Sound
