oai:ecommons.cornell.edu:1813/34132,EXTENDED PROFILE--The Life and Career of Professor Istvan Deak,"This is the first in a series of extended profiles on the lives and careers of scholars who work on East-Central Europe. It features several interviews with Istvan Deak (b. 1926), Seth Low Professor Emeritus at Columbia University. Deak is the author of several books, including: Weimar Germany's Left-wing Intellectuals (1968); The Lawful Revolution: Louis Kossuth and the Hungarians, 1848-1849 (1979); Beyond Nationalism: A Social and Political History of the Habsburg Officer Corps, 1848-1918 (1990); Essays on Hitler's Europe (2001). He also co-edited, together with Jan Gross and Tony Judt, The Politics of Retribution in Europe: World War II and Its Aftermath (2000). The interviews were conducted at Prof. Dek's home in New York on December 5, 2009 and April 18, 2010. Special thanks go to Ph.D. candidate in History at Cornell University, Mt Rig, for his assistance in recording and cataloging the interviews.","Interview Themes: FIRST INTERVIEW SERIES--Part 1 - December 5, 2009: (0:45) Family; (1:37) Jewish ancestors, Moravia, 18th century, Szekesfehervar free royal city, Jews with an exception who were allowed to reside within city limits; (3:00-4:55) Great-grandfather, Emmanuel, served in the Hungarian national guard; (4:56) Maternal side, Jewish family, one rabbi ancestor, listed in Revai nagy lexicona (entry at right); (6:20) Zipser family, reformed rabbi of Szekesfehervar, maternal great-grandfather of Deak; preached in Hungarian in the mid-19th century; (7:00) For his pro-Hungarian attitudes this rabbi ancestor entered into conflicts with more conservative Jews and had to move to Rohonc, Hungary; (7:46) Jewish laws, 1930s, social gap between priviliged and poor Jews in Horthys Hungary and during the Holocaust; 1938 Jewish Laws in Hungary favored Jews with long-standing origins in Hungary; (9:08) Chances of survival of his family during the Holocaust; (9:45) Original family  name ""Deutsch""; (11:00) No knowledge of Yiddish among his ancestors; Grandfather spoke high German; Some of his grandfathers siblings lived in Germany during Nazi times; (12:00) Textile merchant grandfather with a store on the main square of Szakesfehervar, highly respected patrician of the city who went to his store in a carriage in 1930s; (13:00) Large textile store; (15:27) Grandfather born in 1852; (16:00) WWI; (16:08) His father [Istvan] attended Cistercian Gymnasium in Szekesfehervar; Half the class was Jewish, including Deaks father; (17:07) No discrimination against Deaks father and grandfather; His father never complained of anti-Semitism until WWII; (17:50) Deaks fathers patriotic attitude towards Hungarian army till 1941; (18:20) Father attended Polytechnic University; Drafted into k.u.k. (Habsburg) army in 1914, fortress artillery; (19:00) Deaks fathers experience on the Russian front, WWI; no tales of miseries, amusing anecdotes only; (19:51) General spotted and scolded Deaks father because he did not grow a mustache; (22:17) Deaks father sent to Montenegro; the only military victory of his unit; (23:00) Brusilov offensive; (23:40) Cossacks; (23:52) Deaks father transferred to Vienna in 1916, then charged with managing an ammunition depot at the end of the war in northern Italy; (26:00) Bad situation of POWs during WWI due to malnutrition, about a third of them died; (27:24) Deaks father blew up the ammunition depot when Austria-Hungary surrendered; (28:00) Ethnic composition of Deaks fathers unit; All reserve officers were Budapest engineers; (29:00) Reunion of Deaks fathers WWI unit commanders in 1970s in Budapest; (29:30) Journey back from the front; (31:00) Deaks father stayed in the army after 1918 to support himself; (31:40) Deaks father became a Red Army soldier then a White Army soldier; (32:40) 1920 - Demobilized; Well-to-do family members helped Deaks father transition to civilian life; (34:00) 1920 - marriage of Deks parents; 1922 - Deks sister va is born; Deks father becomes a partner in a company; (35:00) 1926 - Family moved to Budapest; First apartment in Naphegy neighborhood in Buda; House overlooking the Danube; (36:00) Fathers brothers are wealthy merchants, with a car and trip to the Berlin Olympics; (36:30) Great Depression, collapse of Deaks fathers company; Partner absconded to USA; (37:21) Deaks grandfather and siblings pledge half a million peng to save Deks father; (38:40) Fathers new job as chief engineer of BART bus company of Budapest; (39:00) Deaks free entry to Palatinus bath on Margaret Island; (40:06) Father became chief secretary of the Association of Industrial Applied Arts in mid-1930s; He also rented and managed a garage for automobiles; (41:36) Italian balilla visited Budapest and parked their motorcycles in Deks fathers garage; (42:00) Why Fascism was attractive to young people; (43:09) Hitlerjugend; (44:00) Nazism as experience of modernity and; (45:00) egalitarianism; (45:40) German attack on Yugoslavia through Hungary; egalitarianism; (47:21) Deaks father in the USA to oversee the closing of the Hungarian pavilion; Went back in 1940 with steamship Rex; (48:30) Family relations; (50:17) Jewish-Gentile family relations; (51:00) Deaks mother, education, fluent in German

Part 2 - December 5, 2009: (00:00)  Deaks mother [Anna Timar], homemaker; (00:49) A housewifes daily routine; (3:45) Summer vacations every year in Austria in the 1930s; His fathers mother tongue was German; (5:00) Parents spoke German and French; (7:08) Assimilation in Deks family; Conversion of Deaks father; (7:50) Istvan Deak born a Catholic; (8:15) Revelation of Jewish origins at the age of 12; Experience of being Jewish in the 1930s; (9:50) Strategies of his family in the face of rising anti-Semitism in the 1920s and 1930s; (11:30) Istvan Deak, Sr. as a practicing Catholic in the 1920s; (12:15) Catholic friends, the Hardis; (13:20) Experience of anti-Semitism as a teenager; (13:31) Application to high school, discrimination because of Jewish origins, rejection from the Piarist school; Accepted to Cistercian school as his father attended a Cistercian school; (15:40) Experience of discrimination in the scout movement; (17:00) Accepted to boy scout group due to his fathers bravery in WWI; (18:00) Anti-Semitic insult in the scout movement; (20:20) Aryan social world in Budapest, late 1930s, dilemmas; (23:10) Anti-Jewish law was not applied rigorously; (24:00) Hungarian economy functioned because of Jewish participation till 1944, Jews in Hungary during Jewish laws; (25:00) Deaks father compared the situation of Jews in Hungary to that of blacks in America in the early 1940s; (29:00) Desire for a society without minorities in Hungary; (30:00) Changes of family names during WWII; (32:00) Anti-Swabian sentiment during WWII in Hungary; (34:00) Jewish origins of communist leaders during the Rakosi period; (34:30) [Meta-discussion about which parts of Deaks life are worth discussing in the interview and why]; (37:00) The politics of Deaks family members; (40:00) Trip to Northern Transylvania in 1941; (41:00) Apprenticeship at ceramic works in Korond, Northern Transylvania; (48:00) Hungarian army in Northern Transylvania

Part 3 - December 5, 2009
(00:00) Political views, progressive Catholicism in 1930s, KALOT, trade unions, strikes, Arrow Cross men, Jesuits; (6:00) Political orientation, 1943-1944; (8:00) Bela Stollar; (9:11) Labor service, Father in Kistarcsa internment camp; (13:00) Hatvan, Zoldy, deportations, Jaszbereny; (19:40) Railway line construction, Northern Transylvania; (23:00) Miklos Horthys October 15, 1944 speech; (24:00) Bela Stollar helps Deak to hide; (25:00) Fake uniform during Arrow Cross rule; (26:00) Searching for grandmother in a death march, the worst part of my life; (27:00) Fate of his Jewish grandmother during the Holocaust; (30:00) Arrested by SS men in January 1945; (30:40) Set free by a Hungarian-German SS soldier; (32:00) Soviet occupation; (33:10) First contacts with communism; (36:00) Escape from Soviet captivity; (37:40) Post-1945 political parties, communists, Social Democratic Party; (40:00) Karoly Peyer, Bela Zsolt, Imre Kovacs; (41:00) One reason for leaving Hungary; (42:00) 1947 elections, father disqualified, fake ballots; (44:30)  Passport, adventure of leaving Hungary, French visa; (46:50) Paris, trip to France from Hungary, Experience of the West; (49:10) Zrich; (50:00) Rue Budapest in Paris; (52:00) Life in Paris, second half of 1940s, bureaucratic issues, France as the main haven of stateless persons at the time, work experience in Paris; (1:00:00) Education in France; (1:01:20) London, England, Downing Street experience

SECOND INTERVIEW SERIES
Part 1 - April 18, 2010: (00:31) London; (3:00) Harvesting camp in England as university a student; (9:00) 11 Downing street, meeting Sir Stafford Cripps; (16:00) Paris; (21:00) University life in France, prospects in France, work at Combat; (26:00) Political situation in France, 1940s, 1950s; (30:00) Algeria, split in French society; (43:00) Work at Camuss paper, Combat; (48:00) Arletty, Maurice Chevalier - post-WWII lustration in France; (50:00) Social life, networks in France; (52:00) Views on religion

Part 2 - April 18, 2010: (00:00) Moving to Germany, the early 1950s; (02:40) Work at Radio Free Europe (RFE), 1951-1955, reviewed Hungarian newspapers, mixed experience, expulsion of parents from Budapest as a result; (05:00) privileges in Germany as RFE employee, life in Germany; (10:00) Politics at RFE, hiring part of the extreme right emigration by RFE; (11:12) Julian Borsanyi, Laszlo Bery - participation in the Holocaust; Nazis into liberals; (16:00) 1955-1956, American propaganda towards East-Central Europe; (19:00) Role of RFE in 1956; (26:00) Studies in Germany; (28:00) Expulsion of parents from Mese utca, Budapest to Korosnagyharsany; (33:12) 1956 - Expulsion ends; (34:00) Almost daily correspondence with parents during the Rakosi era; (43:11) German friends, Germany in the 1950s, 1970/-71; (49:00) September 1956, Arrival to USA, graduate life at Columbia University. THIRD INTERVIEW SERIES, Part 1 - October 6, 2013,
(00:12) First visit to US, 1955, settled in 1956 in New York, before the Hungarian Revolution; (02:15) First job at a publishing house in New York; worked for an academic book donation program, for Eastern European Countries; student at Columbia University; (08:15) The experience of the 1956 Revolution in New York; (10:15) Imre Kovcs, Hungarian Peasant Party; bought air ticket for Budapest for November 4, 1956; (12:15) Discussion of Budapest family about emigration; (15:15) Family politics after 1945; victims of communism, expelled from Budapest in 1955; Deks sister wants to stay after 1956; (17:15) Fluid administrative practices in Hungary, 1956; (24:15) Arrival of 56ers to New York; carrier between 1956-1962; (26:15) Different groups of post-1944 emigrants from Hungary; identified himself with 1948er group; Ferenc Nagy; (29:15) CIA sponsored the minority democratic fraction of Hungarian migrs; lack of mass support for democratic leaders of Hungarian emigres among Hungarians in US; (31:15) Tibor Eckhart; (35:15) Overrepresentation of emigres among academics; East-Central European Institute at Columbia University; Henry Roberts; started out as a West-Europeanist; (39:15) Sputnik crisis provided funding for the study of East-Central European history; (40:15) Job offer at Columbia; Hungarian studies at Columbia; Halasi Kun, Jnos Lotz; funding for building an extensive Hungarian library collection; (43:15) Received tenure in 1967; Sputnik money  temporary funding for East-Central European studies; (46:15) Establishment of institutes of study of East-Central European studies in US; setting up centers; (47:45) Academic job crisis in 1970s; (50:15) 1980s and resurgence of East-Central European studies; (53:15) Global history; (55:15) Significance of Sputnik crisis; (58:15) European vs. East-Central European history; book project on European history of collaboration; (59:15) Involved in taking the Crown of Saint Stephen back to Hungary; recollections on the trip with the Crown to Budapest; (1:05:15) Scandal around return of the Crown; rightist Hungarian-American demonstrated; member of the delegation that took back the Crown; (1:15:15) Celebrations in Budapest
(1:17:15)  Relationship to Hungary
(1:22:15) Vision of a democratic Hungary, 1945; Hungarian politics, 1945-2013",,Sound
oai:ecommons.cornell.edu:1813/36248,EXTENDED PROFILE--The Life and Career of Professor Ivan Sanders,"These interviews are the second in a series of extended profiles on the lives and careers of scholars who work on East-Central Europe. It features seven interviews with Ivan Sanders, who teaches Central European cultural history, literary translation, postwar East European cinema, and Hungarian literature at Columbia University. Sanders has translated many famous Hungarian authors into English. His translations include Miln Fst's The Story Of My Wife:The Reminiscences of Captain Strr, Gyrgy Konrd's The City Builder, and Pter Ndas's A Book of Memories. The interviews were conducted at Prof. Sanders's home in New York on December 6, 2009, April 18, 2010, and October 6, 2013. Special thanks go to Ph.D. candidate in History at Cornell University, Mt Rig, for serving as co-interviewer and for his assistance in recording and cataloging the interviews.",,,Sound
oai:ecommons.cornell.edu:1813/36249,"Interview with James Robertson--February 19, 2014","Interview with James Robertson, advanced Ph.D. student in History at NYU. Interview conducted in New York, NY on February 19, 2014. Robertson is currently writing a dissertation on writers and communist thought in interwar Yugoslavia, the working title of which is ""Visions of Community on the Yugoslav Literary Left."" He has written several pieces for The Immanent Frame, an SSRC digital forum on ""Secularism, religion, and the public sphere.""",,,Sound
oai:ecommons.cornell.edu:1813/36250,"Interview with Evan Goldstein--March 20, 2014","Evan Goldstein has been the managing editor of The Chronicle Review since 2012 and of Arts & Letters Daily since 2011. He has written several profiles and other pieces for the Review (on Michael Ignatieff, Kenneth Hayworth, Daniel Kahneman and others). The interview was conducted in his office at The Chronicle of Higher Education in Washington, DC on Thursday, March 20, 2014. He talked about his editorial philosophy and vision for the Review, magazines and editors that inspired him, the past and future of A&LD, the ""great divide"" between editors who track changes and those who don't, what ""ideas journalism"" can make of our time, the (limited) usefulness of new metrics gauging how a piece is being received, what makes a good publicist, and the role of the Review vis--vis the academy, among other themes and ""extraneous tangents.""",,,Sound
oai:ecommons.cornell.edu:1813/36337,Interview with Andrew Romay,"These interviews are the third in a series of extended profiles on the lives of participants in the New York Hungarian Table, which meets for lunch once a month in Morningside in New York City. It features two interviews with Andrew Romay about his experiences in Hungary from the interwar period through 1956. The interviews were conducted at Romay's apartment in New York on February 18 and 25, 2014. Special thanks go to Ph.D. candidate in History at Cornell University, Mt Rig, for his assistance in cataloging the interviews. To download the interviews, click here.","FIRST INTERVIEW: February 18, 2014: 0:00 Birth and Family; 1:30 Family business, father is wholesale salesman; 3:10 Splendid childhood in Hungary; 3:40  Mother; 5:40 Father was more religious, kosher household; 6:30 Miskolc Jewish community, numerus clausus, Jewish students in Catholic high school; 8:30 Antisemitism, Hungarian identity; 9:30 Yiddish; 13:30 Family home; 15:00 Brother, trip to Paris, bother accepted to the Sorbonne, Paris; 17:30 WWII; 18:40 Politics at home, Horthy; 20:50 lack of WWI memory, Trianon
23:50 relatives in Oradea; 27:50 WWII, Hungarys participation; 30:50 Accepted to the University to Economics in 1940. Family moves to Budapest 1940; 32:50 Studies economics in 1940s. School of economics similar to current classics. Initially wanted to study medicine; 33:50 Readings at university; 39:50 politicized daily life, friendships; 42:50  Jewish-non-Jewish relations; 44:50 1945 as a radical break; 45:50 saved by university student status, deferred labor service till 1944; 47:10 student status saved him from labor service for years; 53:05 forced labor camp conditions, labor battalions; 57:50 Protected houses; 59:50 Rescue efforts by the Catholic church; refuses to convert to Catholicism, friend converts in his stead in summer 1944; 1:04:50 Arrow crossmen deport him to Mauthausen; 1:05:50 Escapes from Mauthausen; 1:10:55 concentration camp memoir of Romay [published as ""De Profundis: Memoir of an Inmate at Mauthausen Concentration Camp, March-May 1945,"" published in the Austian History Yearbook, Vol. XXVII (1996): 301-11]; 1:14:00 liberation of the camp by US soldiers; encounter of US soldiers with camp inmates, apocalyptic scene. Inmates naked for weeks before liberation; 1:17:50 US troops put him in a rehabilitation camp, on the site of the previous camp; 1:18:15 health problems after liberation: couldnt swallow as a result of starvation; many former inmates died after liberation; 1:19:40 Could speak English with US soldiers; 1:24:10 Anomalous relationship between camp inmates and survivors; 1:26:45 One-month recovery, then taken back by train to Budapest. Family survived in the ghetto. Brother survived in Miskolc; 1:28:40 Encounter with parents. They didnt talk about his camp experience; 1:31:10 Experience of returning to Budapest in 1945. Stayed in bed for months. Rumors about the total destruction of Budapest; 1:33:30 Parents returned to the same apartment as they lived in before; 1:34:15 Shortages in Budapest. SECOND INTERVIEW: February 25, 2014; 00:00 Labor service in Western Hungary; 04:20 Forced march into Germany, infections, chaotic march, saved by luck; 08:00 SS killings of forced laborers in Eastern Austria; 13:20 Massive death toll among laborers, starvation; 19:00 Jewish forced laborers forced in a crammed barge in winter 1945; 23:00 Liberation by US troops, sent home after a month of recovery; 28:00 Reuniting with family members in Budapest; everyone survived; 33:00 Learns that luck saves him in 1945, as the SS kills sick laborers who stayed behind; 35:30 Meets George Soros father Tivadar through the Hungarian Esperanto Society, presided over by Tivadar Soros; 40:00 Tivadar Soros escape from Siberia in 1917; 44:40 Tivadar Soros rescue efforts in 1944; 45:00 Emigration decisions at the Soros family, 1945, 1956; 48:00 Lack of a homogenous holocaust experience; 55:00 Communist turn of most of Romays friends after 1945; 1:00:00   Failed escape attempt from Hungary during Rkosi period in 1949. Captured at the same place where he did forced labor in 1945; 1:01:00 Greeted at the Hungarian secret service headquarters as stinking fascist at 60 Andrssy t in Budapest; 1:05:00 Former inmates and Jewish survivors of Nazism who became communist did not help him when in prison; 1:07:00 In prison for eight months as enemy of the people; 1:08:00 Impossibility of finding a job as a capitalist economist; gets job by denying his university education; 1:09:00 Finds job at a foreign trade company; 1:10:00 New director of the company is fully informed of Romay past that he wanted to hide, as the director was working for the secret service (.V.H.) before. Director and Romay shared the same social background, both issued from Hungarian-Jewish middle class families. New director was hostile to Romay and suggests that he confesses everything to the party secretary about his past as enemy of the people""; 1:17:00 No further discrimination against him at the company; directors of the company were fully incompetent, without education; 1:18:00 Hungarian foreign trade handled badly and ineffectively due to the appointment of trustworthy party members; 1:20:00 Works at the company till 1956; 1:21:00 Former college friend becomes communist minister, who gets him a job as a laborer; experience of being deceived by Hungarian Jewish friends, once again; 1:23:00 Appointed to work at a factory outside of Budapest before he got the foreign trading job; worked as a physical laborer at an aniline factory; 1:24:00 Works with a wheelbarrows; 1:26:00 Gives up job at the factory due to health reasons; 1:28:00 When visiting Hungary in 1970s, he questions former college friend who appoints him to a factory job why he did so.",,Sound
