oai:ecommons.cornell.edu:1813/2634,Future of Public Services presentation for Academic Assembly,"In this audio recording of the presentation given to Academic Assembly on Feb. 2, 2006, Anne Kenney, AUL for Instruction, Research, and Information Services, shares her vision of the future of public services over the next five years.",,audio/mp3,Sound
oai:ecommons.cornell.edu:1813/3115,"Professional Development Week Reception Remarks and Lecture, May 2006","Wine & Hors d'oeuvres Reception, Lecture and Poster Session for beginning of Professional Development Week held on Monday, May 22, 2006. Opening Remarks by Sarah Thomas and talk--""Cornell's Global Preservation Efforts""--by John Dean",,audio/mp3,Sound
oai:ecommons.cornell.edu:1813/3569,A Talk on Job at Sage Chapel (audio),"Prof. Marcham reads from and comments on the Book of Job, March 29, 1992, in
the Cornell University chapel.
Length: 14:27,",,video/quicktime,Sound
oai:ecommons.cornell.edu:1813/5771,Geologic and Strategic Comments on Oil Resources in the Arabian Gulf Region,"Peak oil production in the Middle East's Arabian/Persian Gulf region and worldwide could be delayed if major multinational and national oil companies would invest more heavily in drilling and extraction technologies and push to explore new sites.

Barazangi argued that the ""exploration story"" in the Middle East is not yet complete. Two-thirds of the world's proven recoverable oil reserves exist in the Arabian Gulf, and there are more oil fields to be discovered through offshore and deep-water drilling, as well as more oil to be extracted from existing fields.

Barazangi stressed the fact that only seven countries worldwide (Saudi Arabia, Iran, Iraq, Kuwait, United Arab Emirates, Venezuela, and Russia) contain 80 percent of the world's proven recoverable oil reserves. Five of those are notably in the Arabian Gulf region and share Islamic cultures. He argued that in order to better understand oil issues in the Gulf, the world must understand the Arab and Persian people, and Islam's history and culture.",This audio recording is in Arabic.,audio/mp3,Sound
oai:ecommons.cornell.edu:1813/7632,Uris Library Historical Tour,"The Uris Library Historical Tour focuses on the library's history and showcases its noteworthy architecture, collections and artwork. Cornell's oldest library, now known as Uris Library, was built in 1891. Elements of the university's history are preserved in the architecture and art work that fills Uris. The Uris Library Historical Library Tour podcast highlights the building's Dean Room, the Class of 1957 - Kinkeldey Room, the Andrew Dickson White Library and Jacques Lipchitz's sculpture, Song of the Vowels.",,audio/mp3,Sound
oai:ecommons.cornell.edu:1813/7646,"Religion and culture - the nature of religion; Cornell University lecture, Natural Resources  407 (1994-01-25)","Introduction: Religion and culture - the nature of religion; personal stories from January 25, 1994.",,audio/mp3,Sound
oai:ecommons.cornell.edu:1813/7662,"The epistemological status of moral claims; Cornell University lecture, Natural Resources  407 (2001-09-04)","The epistemological status of moral claims, CS Lewis The Abolition of Man, human dominance over nature; Thomas Merton.","Lecture was recorded on a Lapel Microphone, using a Cassette Tape (NOTE: incomplete recording).",audio/mp3,Sound
oai:ecommons.cornell.edu:1813/7663,"Friends; Cornell University lecture, Natural Resources  407 (2003-12-04)",Friends.,"Lecture was recorded on a Lapel Microphone, using a Sony Minidisk Recorder.",audio/mp3,Sound
oai:ecommons.cornell.edu:1813/7664,"How should we live?; Cornell University lecture, Natural Resources  407 (2003-12-04)","How should we live?, CS Lewis, sehnsucht, the sweet poison of the false infinite, overzealous reformers and planners, praise and celebration, cosmic compost, Merlin Caruthers, Thomas Merton.","Lecture was recorded on a Lapel Microphone, using a Sony Minidisk Recorder.",audio/mp3,Sound
oai:ecommons.cornell.edu:1813/7665,"How much of heaven is available to us now?; Cornell University lecture, Natural Resources  407 (1994-04-14)","How much of heaven is available to us now? How much of the biocentric agenda is implementable without becoming inhumane?  pros and cons of anthropo-, bio-, and theo-centrism; Parfit's dilemma - our obligations to future generations; John Passmore, Man's Responsibility to Nature; theistic, Christian, Jewish approaches; biocentrics as prophets of the ideal.","Lecture was recorded on a Lapel Microphone, using a Cassette Tape.",audio/mp3,Sound
oai:ecommons.cornell.edu:1813/7666,"What is nature?; Cornell University lecture, Natural Resources  407 (2001-09-18)","What is nature, discussion, the infamous caterpillar example.","Lecture was recorded on a Lapel Microphone, using a Cassette Tape.",audio/mp3,Sound
oai:ecommons.cornell.edu:1813/7667,"The Machine In The Garden; Cornell University lecture, Natural Resources  407 (1994-04-19)","The Machine In The Garden (also the title of a book by Leo Marx): the Walden Pond restoration project; Martin Lewis, Green Delusions; the biocentric world view; breeding endangered species in captivity; Michael Pollan, Second Nature, A Gardener's Education; the garden metaphor vs. the wilderness metaphor; primitivism, primal purity, decentralization, ""appropriate technology"", capitalism as evil; Rodman, Four Forms of Ecological Consciousness Reconsidered; the principle of non-intervention, the California Condor, ""better dead than bred""..","Lecture was recorded on a Lapel Microphone, using a Cassette Tape.",audio/mp3,Sound
oai:ecommons.cornell.edu:1813/7668,"Environmental studies - theory vs. specifics; Cornell University lecture, Natural Resources  407 (1994-01-27)",Environmental studies - theory vs. specifics.,"Lecture was recorded on a Lapel Microphone, using a Cassette Tape.",audio/mp3,Sound
oai:ecommons.cornell.edu:1813/7669,"God and Religion; Cornell University lecture, Natural Resources  407 (1994-02-01)","God and Religion: William Cantwell Smith The Meaning and End of Religion, ""religio"", reification, God reveals not religion, but himself; the language of discourse in the university, the importance of soft knowledge.","Lecture was recorded on a Lapel Microphone, using a Cassette Tape.",audio/mp3,Sound
oai:ecommons.cornell.edu:1813/7670,"Religion in the University; Cornell University lecture, Natural Resources  407 (1994-02-03)","Religion in the University: Emil Brunner, Jefferson and the use of the word sectarian, implications for government public schools, the Big Questions, religious neutrality, a functional view of religion, Emil Durkheim, the Cornell School of Human Ecology, discussion.","Lecture was recorded on a Lapel Microphone, using a Cassette Tape (Exceptional Lecture).",audio/mp3,Sound
oai:ecommons.cornell.edu:1813/7671,"Moral judgments, epistemology and Liberal thinking; Cornell University lecture, Natural Resources  407 (1994-02-08)","Moral judgments, epistemology and Liberal thinking, enlightenment and post-modern reasoning, polishing bowls.","Lecture was recorded on a Lapel Microphone, using a Cassette Tape.",audio/mp3,Sound
oai:ecommons.cornell.edu:1813/7672,"Knowledge claims in the hard sciences and humanities; Cornell University lecture, Natural Resources  407 (1994-02-10)","Wayne Booth The Rhetoric of Assent, knowledge claims in the hard sciences vs. knowledge claims in the humanities, Neurath's boat, how to show proper respect for moral and religious arguments. .",,audio/mp3,Sound
oai:ecommons.cornell.edu:1813/7673,"Descriptive vs. normative ethics, meta-ethics, etc.; Cornell University lecture, Natural Resources  407 (1994-02-22)","Descriptive vs. normative ethics, meta-ethics, logical positivism, the extent of ethical consensus, John Rawls ""reflective equilibrium"", teleological ethics, Alistair MacIntyre .","Lecture was recorded on a Lapel Microphone, using a Cassette Tape.",audio/mp3,Sound
oai:ecommons.cornell.edu:1813/7674,"Deontological ethics and social contract theories; Cornell University lecture, Natural Resources  407 (1994-02-24)","Deontological ethics, social contract theories, John Rawls A Theory of Justice, Jeremy Bentham and John Stuart Mill (utilitarians), ""rights"", English Liberalism, John Locke.","Lecture was recorded on a Lapel Microphone, using a Cassette Tape.",audio/mp3,Sound
oai:ecommons.cornell.edu:1813/7675,"Stanley Hauerwas on Iris Murdoch; Cornell University lecture, Natural Resources  407 (1994-03-01)","Stanley Hauerwas on Iris Murdoch, the meaning of ""freedom"", rationality in the service of desire vs. being part of a worthy story, cost-benefit analysis vs. ""unselfing"", Aleksandr Solzhenitsyn, discussion.","Lecture was recorded on a Lapel Microphone, using a Cassette Tape (Exception Lecture).",audio/mp3,Sound
oai:ecommons.cornell.edu:1813/7676,"Uriah the Hittite, ideological taint, sensuality vs. pride; Cornell University lecture, Natural Resources  407 (1994-03-03)","Uriah the Hittite, ideological taint, sensuality vs. pride.","Lecture was recorded on a Lapel Microphone, using a Cassette Tape (Exceptional Lecture).",audio/mp3,Sound
oai:ecommons.cornell.edu:1813/7677,"Greek vs. Hebrew views of history; Cornell University lecture, Natural Resources  407 (1994-03-10)","Greek vs. Hebrew views of history, discussion of Deut. 26, Deut. 6:20-25, the indicative precedes the imperative.","Lecture was recorded on a Lapel Microphone, using a Cassette Tape.",audio/mp3,Sound
oai:ecommons.cornell.edu:1813/7678,"Historical time line for Judaism and Christianity; Cornell University lecture, Natural Resources  407 (1994-03-12)","Galatians, historical time line for Judaism and Christianity, Gospel precedes Law, Peter, Paul, and circumcision, Harvard grad school, Emil Brunner, how are we to love our neighbor?.","Lecture was recorded on a Lapel Microphone, using a Cassette Tape.",audio/mp3,Sound
oai:ecommons.cornell.edu:1813/7679,"Controlling nature; Cornell University lecture, Natural Resources  407 (1994-03-17)","Controlling nature: Leiss The Domination of Nature, the myth of Icarus, Francis Bacon, Betrand Russell Icarus, or the Future of Science, Mircea Eliade The Forge and the Crucible, alchemy and magic, the secular version of the alchemist's dream as the driving force in modern society, Goethe's Faust, CS Lewis The Abolition of Man and That Hideous Strength, discussion.","Lecture was recorded on a Lapel Microphone, using a Cassette Tape (Exceptional Lecture).",audio/mp3,Sound
oai:ecommons.cornell.edu:1813/7680,"A feminist perspective on environmental ethics; Cornell University lecture, Natural Resources  407 (1994-03-29)","A feminist perspective on environmental ethics: Carol Gilligan, Val Plumwood, the effects of the sexual revolution, daycare vs. parental care, Wendell Berry The Unsettling of America.","Lecture was recorded on a Lapel Microphone, using a Cassette Tape (Exceptional Lecture).",audio/mp3,Sound
oai:ecommons.cornell.edu:1813/7681,"The meaning of nature: class discussion; Cornell University lecture, Natural Resources  407 (1994-03-31)",Class discussion: the meaning of nature: can human beings be fully comprehended under the term nature? Are human beings more valuable than any other part of nature? The infamous caterpillar example.,"Lecture was recorded on a Lapel Microphone, using a Cassette Tape (Exceptional Lecture).",audio/mp3,Sound
oai:ecommons.cornell.edu:1813/7682,"What is nature?; Cornell University lecture, Natural Resources  407 (1994-04-05)","What is nature? Gordon Kaufman The Concept of Nature: A Problem for Theology; terms: nature, natural, artificial, world, cosmos, universe.","Lecture was recorded on a Lapel Microphone, using a Cassette Tape (Exceptional Lecture).",audio/mp3,Sound
oai:ecommons.cornell.edu:1813/7683,"Anthropocentrism; Cornell University lecture, Natural Resources  407 (1994-04-07)","Anthropocentrism, efficacy of ethics courses vs. great literature and drama in forming ""environmental character"", Joseph Sachs, biocentrism, Lynn White The Historical Roots of Our Ecological Crisis, conservatism regarding ""nature"" vs. conservatism regarding ""human nature"".","Lecture was recorded on a Lapel Microphone, using a Cassette Tape.",audio/mp3,Sound
oai:ecommons.cornell.edu:1813/7684,"Biocentrism and animal rights; Cornell University lecture, Natural Resources  407 (1994-04-12)","Biocentrism and animal rights; Paul Taylor, The Ethics of Respect for Nature; Peter Singer, Animal Liberation - human beings are not different from other animals in any qualitative sense; Regan, Animal Rights and Human Obligations: the rights view - attempts to limit the rights view to human beings are ""rationally defective""; Paul Taylor - extends rights to plants; the Image of God as the origin of human equality; the bigotry of modern philosophers.","Lecture was recorded on a Lapel Microphone, using a Cassette Tape (Exceptional Lecture).",audio/mp3,Sound
oai:ecommons.cornell.edu:1813/7685,"Ideological solutions vs. practical solutions, and other topics; Cornell University lecture, Natural Resources  407 (1994-04-21)","Barry Smith, ideological solutions vs. practical solutions, Baer's Garbage Principle, justice issues, John Rawls, foreign aid, Peter Berger and Richard John Neuhaus To Empower People - mediating structures, government neutrality on issues of The Good, the effects of private sexual behavior on our ability to address environmental issues - illegitimacy and single parenting.","Lecture was recorded on a Lapel Microphone, using a Cassette Tape.",audio/mp3,Sound
oai:ecommons.cornell.edu:1813/7686,"The nature of the environmental debate; Cornell University lecture, Natural Resources  407 (1994-04-28)","The nature of the environmental debate, extremist language, the Loyal Opposition, magnanimity and trust vs. government regulation, developing standards for truth-telling in the context of contentious issues, elephants in Zimbabwe, the Boston Rt 128 loop, development value, Henry George Progress and Poverty, ethics of transition and compromise, Spotted Owl habitat, property use restrictions.","Lecture was recorded on a Lapel Microphone, using a Cassette Tape.",audio/mp3,Sound
oai:ecommons.cornell.edu:1813/7687,"The God Who Plays; Cornell University lecture, Natural Resources  407 (1994-05-03)",The God Who Plays.,"Lecture was recorded on a Lapel Microphone, using a Cassette Tape (Exceptional Lecture).",audio/mp3,Sound
oai:ecommons.cornell.edu:1813/7688,"Celebration, praise, and thanksgiving; Cornell University lecture, Natural Resources  407 (1994-05-05)","Celebration, praise, and thanksgiving.","Lecture was recorded on a Lapel Microphone, using a Cassette Tape.",audio/mp3,Sound
oai:ecommons.cornell.edu:1813/7689,"Foundations for a Jewish Environmental Ethic; Cornell University lecture, Natural Resources  407 (1994-04-26)","Foundations for a Jewish Environmental Ethic: the Biblical world view, the world and all that is in it belongs to God, Lynn White's article, Jewish law - human autonomy subject to restraint; there is purpose to everything in creation; God is continuously active in creation; the connection between social and ecological justice; the Sabbath year; spirituality and the wilderness experience; all creation as a ""community of praise""; laws regarding ownership and use of property; the Sabbath as a curb on unbridled consumption and acquisition; discussion.","Lecture was recorded on a Lapel Microphone, using a Cassette Tape (Exceptional Lecture).",audio/mp3,Sound
oai:ecommons.cornell.edu:1813/7690,"Epistemology (discussion); Cornell University lecture, Natural Resources  407 (2001-09-06)","Epistemology (discussion): radical doubt, ""knowledge equals certainty"", warrantable assertions, examples: gratuitous harm and truth-telling, difference between hard and social sciences, experimental method, literature as thought-experiment, learning by mistakes (eg. no-fault divorce), unprovable assumptions of science.","Lecture was recorded on a Lapel Microphone, using a Cassette Tape (Exceptional Lecture).",audio/mp3,Sound
oai:ecommons.cornell.edu:1813/7691,"Epistemology, Kaufman, Barbour, Sagan, etc.; Cornell University lecture, Natural Resources  407 (2001-09-25)","Epistemology, Gordon Kaufman, Ian Barbour, Carl Sagan, the Genesis account from the Bible, H. and H.A. Frankfort Before Philosophy, personalized nature, myths, an example of a scientific myth.","Lecture was recorded on a Lapel Microphone, using a Cassette Tape.",audio/mp3,Sound
oai:ecommons.cornell.edu:1813/7692,"The de-mythologizing and de-sacralizing of nature; Cornell University lecture, Natural Resources  407 (2001-09-27)","The de-mythologizing and de-sacralizing of nature, Greek philosophy, natural causes for natural events, cyclical vs. linear view of time, David and Bathsheba, discussion.","Lecture was recorded on a Lapel Microphone, using a Cassette Tape (NOTE: incomplete recording).",audio/mp3,Sound
oai:ecommons.cornell.edu:1813/7693,"The modern university; Cornell University lecture, Natural Resources  407 (2003-12-02)","The modern university, Aleksandr Solzhenitsyn, questions and comments about the course, imposing beliefs on others.","Lecture was recorded on a Lapel Microphone, using a Sony Minidisk Recorder.",audio/mp3,Sound
oai:ecommons.cornell.edu:1813/7694,"Anthropocentrism, biocentrism, theocentrism, etc.; Cornell University lecture, Natural Resources  407 (2003-11-25)","Anthropocentrism (Joseph Sachs), biocentrism (Paul Taylor), theocentrism (St. Agustin, St. Thomas), John Locke, ""positive law"" and ""rights"", CS Lewis.","Lecture was recorded on a Lapel Microphone, using a Sony Minidisk Recorder (NOTE: incomplete recording).",audio/mp3,Sound
oai:ecommons.cornell.edu:1813/7695,"The future of Natural Resources 407; Cornell University lecture, Natural Resources  407 (2003-11-25)",The future of NR-407.,"Lecture was recorded on a Lapel Microphone, using a Sony Minidisk Recorder.",audio/mp3,Sound
oai:ecommons.cornell.edu:1813/7696,"Land application of wastewater sludge - science, policy, and politics; Cornell University lecture, Natural Resources  407 (2003-10-23)","Land application of wastewater sludge - science, policy, and politics.","Lecture was recorded on a Lapel Microphone, using a Sony Minidisk Recorder (NOTE: incomplete recording).",audio/mp3,Sound
oai:ecommons.cornell.edu:1813/7697,"No-kill animal shelters, feral cats vs. wildlife, hunting; Cornell University lecture, Natural Resources  407 (2003-11-20)","No-kill animal shelters, feral cats vs. wildlife, hunting.","Lecture was recorded on a Lapel Microphone, using a Sony Minidisk Recorder.",audio/mp3,Sound
oai:ecommons.cornell.edu:1813/7698,"Introduction: How should we live?; Cornell University lecture, Natural Resources  407 (2003-08-28)","Introduction: How should we live? intentions vs. performance, Bill Joy Why the future doesn't need us, the theology of the ballet, CS Lewis The Abolition of Man, discussion.","Lecture was recorded on a stereo microphone, using a Sony Minidisk Recorder.",audio/mp3,Sound
oai:ecommons.cornell.edu:1813/7699,"Guided discussion on values and facts, theoretical certainty, and knowledge as warrantable assertions; Cornell University lecture, Natural Resources  407 (2003-09-02)","Guided discussion on values and facts, theoretical certainty, knowledge as warrantable assertions.","Lecture was recorded on a stereo microphone, using a Sony Minidisk Recorder (Exceptional Lecture).",audio/mp3,Sound
oai:ecommons.cornell.edu:1813/7700,"Sachs, facts, values, knowledge, relativism, radical doubt; Cornell University lecture, Natural Resources  407 (2003-09-04)","How to read the assigned readings, Sachs, facts, values, knowledge, relativism, radical doubt.","Lecture was recorded on a stereo microphone, using a Sony Minidisk Recorder.",audio/mp3,Sound
oai:ecommons.cornell.edu:1813/7701,"Carl Sagan's Cosmos vs. Genesis; Cornell University lecture, Natural Resources  407 (2003-09-11)","Carl Sagan's Cosmos vs. the Genesis accounts of creation, human dominion over nature, freedom, determinism, moral responsibility, Gordon Kaufman on Kant The Concept of Nature: A Problem for Theology, what is nature? can human beings be fully comprehended under the term nature? The terms world, cosmos, and universe, brief discussion.","Lecture was recorded on a stereo microphone, using a Sony Minidisk Recorder.",audio/mp3,Sound
oai:ecommons.cornell.edu:1813/7702,"The relationship between humans and nature; Cornell University lecture, Natural Resources  407 (2003-09-16)","Relationship between humans and nature, dominion over nature, H. and H.A. Frankfort Before Philosophy, ancient and modern cultural myths, Lynn White The Historical Roots of Our Ecological Crisis, Western scientific progress and the desacralization of nature, Louis Moncrief The Cultural Basis of Our Environmental Crisis, democratization and the exploitation of nature, Biblical environmentalism, short discussion.","Lecture was recorded on a stereo microphone, using a Sony Minidisk Recorder.",audio/mp3,Sound
oai:ecommons.cornell.edu:1813/7703,"The meaning of the term nature; Cornell University lecture, Natural Resources  407 (2003-09-18)","The meaning of the term nature, consequences of the desacralization of nature, King David and Nathan the prophet, the romanticization of nature, the need for historical imagination.","Lecture was recorded on a Lapel Microphone, using a Sony Minidisk Recorder (NOTE: incomplete recording).",audio/mp3,Sound
oai:ecommons.cornell.edu:1813/7704,"The desacralization of nature; Cornell University lecture, Natural Resources  407 (2003-09-23)","The desacralization of nature, Leo Marx Pastoral Ideals and City Troubles, recurring themes in literature - retreat from civilization, escape to nature, return to civilization; The Interrupted Idyll, symbolic landscape, lengthy discussion - racism, breakdown of family structure, lack of diverse viewpoints at Cornell.","Lecture was recorded on a stereo microphone, using a Sony Minidisk Recorder.",audio/mp3,Sound
oai:ecommons.cornell.edu:1813/7705,"Philosophy of science - faith and reason, values and facts; Cornell University lecture, Natural Resources  407 (2003-09-25)","Philosophy of science - faith and reason, values and facts; fallibism, running commentary on Ian Barbour Issues in Science and Religion: logical positivism and the ""verification principle"", factual claims vs. value claims, Michael Polanyi Personal Knowledge, brief discussion.","Lecture was recorded on a Lapel Microphone, using a Sony Minidisk Recorder (Exceptional Lecture).",audio/mp3,Sound
oai:ecommons.cornell.edu:1813/7706,"Arterial roads and development - a case study; Cornell University lecture, Natural Resources  407 (2003-09-30)",Arterial roads and development - a case study.,"Lecture was recorded on a Lapel Microphone, using a Sony Minidisk Recorder.",audio/mp3,Sound
oai:ecommons.cornell.edu:1813/7707,"Science, knowledge, and nature; Cornell University lecture, Natural Resources  407 (2003-10-02)","Allen Wood Relativism, indoctrination in K-12 schools, Ian Barbour, what motivates scientists, William Leiss The Domination of Nature, science as knowledge for knowledge's sake (middle ages) vs. knowledge for the sake of domination of nature (modern era), the value of the scientific practice of viewing nature as value-free, the intuitive fear of the power of technology, Francis Bacon, Bertrand Russell Icarus, or the Future of Science, Mircea Eliade The Forge and the Crucible alchemy and modern science, mining and metallurgy, the Faustus legend, discussion.","Lecture was recorded on a Lapel Microphone, using a Sony Minidisk Recorder (Exceptional Lecture).",audio/mp3,Sound
oai:ecommons.cornell.edu:1813/7708,"Science in the context of an absence of transcendent authority; Cornell University lecture, Natural Resources  407 (2003-10-07)","Science in the context of an absence of transcendent authority, the need for authoritative community, a functional view of religion, Emil Durkheim, the Big Questions, Wilfred Cantwell Smith.","Lecture was recorded on a Lapel Microphone, using a Sony Minidisk Recorder (Exceptional Lecture).",audio/mp3,Sound
oai:ecommons.cornell.edu:1813/7709,"The limitations of rationalism in ethics, male and female perspectives; Cornell University lecture, Natural Resources  407 (2003-10-09)","The limitations of rationalism in ethics, male and female perspectives, Carol Gilligan, modern feminism, the environmental effect of social pathologies.","Lecture was recorded on a Lapel Microphone, using a Sony Minidisk Recorder.",audio/mp3,Sound
oai:ecommons.cornell.edu:1813/7710,"Stanley Hauerwas on Iris Murdoch: running commentary; Cornell University lecture, Natural Resources  407 (2003-10-28)","Running commentary on Stanley Hauerwas on Iris Murdoch, the concepts of freedom, humility, and love.","Lecture was recorded on a Lapel Microphone, using a Sony Minidisk Recorder.",audio/mp3,Sound
oai:ecommons.cornell.edu:1813/7711,"Wendell Berry, hyper-individualism, and faithfulness to each other and to the environment; Cornell University lecture, Natural Resources  407 (2003-10-30)","Wendell Berry, hyper-individualism and faithfulness to each other and to the environment, the environmental effect of social pathologies, the interrelatedness of things, David Blankenhorn, fatherlessness.","Lecture was recorded on a Lapel Microphone, using a Sony Minidisk Recorder.",audio/mp3,Sound
oai:ecommons.cornell.edu:1813/7712,"What do Christianity and Judaism have to say about environmental ethics?; Cornell University lecture, Natural Resources  407 (2003-11-04)","What do Christianity and Judaism have to say about environmental ethics, Plato, the ancient Hebrews, Deuteronomy 26:1-9, Joshua, the Decalogue, Emil Brunner.","Lecture was recorded on a Lapel Microphone, using a Sony Minidisk Recorder.",audio/mp3,Sound
